article,summary
"Vincent Lambert: Siapa sosok yang berada di pusat perdebatan hak untuk mati di Prancis?.
Keluarga Vincent Lambert menyediakan foto saat Vincent berada di tempat tidur rumah sakit tahun 2015, meminta agar wajahnya dikaburkan. Vincent Lambert, 42 tahun, berada dalam keadaan vegetatif - hidup tapi lumpuh total - sejak mengalami kecelakaan sepeda motor 11 tahun lalu. Dokter mulai memutus pipa makanan minggu lalu sesudah ada keputusan akhir dari pengadilan kasasi di Prancis. Eutanasia - mengakhiri dengan sengaja hidup seseorang yang sakit berat secara tenang dan mudah atas dasar perikemanusiaan - merupakan tindakan ilegal di Prancis. Tetapi dokter diperbolehkan melakukan bius mendalam bagi pasien yang sakit sangat parah. Kasus Vincent Lambert ini menyebabkan kontroversi tajam baik di keluarganya maupun di Prancis, hingga memicu demonstrasi di jalan-jalan di Paris. Keponakannya menyatakan Vincent meninggal pukul 08.24 waktu setempat, sembilan hari sesudah pipa makannya dicabut. Pada tanggal 2 Juli, Pengadilan Kasasi di Prancis memutuskan untuk memperbolehkan dokter mencabut pipa makan untuk Vincent Lambert, yang merupakan mantan perawat psikiater. Tim medis di Rumah Sakit Sébastopol di kota Reims kemudian mulai mencabut pipa makannya sambil memastikan ""pembiusan mendalam dan berkesinambungan"". Orang tua Vincent Lambert terus berupaya mempertahankan agar anak mereka tetap hidup. Namun mereka diberitahu bahwa sudah tak ada upaya hukum yang bisa dilakukan lagi. Hari Senin (08/07) mereka ""mengundurkan diri"" untuk menerima kematian putra mereka. Upacara diselenggarakan di Paris hari rabu (10/07) untuk memberi dukungan kepada Vincent Lambert. Ayahnya, Pierre Lambert, 90, meggambarkan keputusan pengadilan kasasi itu sebagai ""pembunuhan tersembunyi"" dan ""eutanasia"". Namun istri Vincent Lambert dan banyak orang lain berpendapat bahwa membiarkan Vincent meninggal dunia merupakan jalan kemanusiaan. Apa yang terjadi dengan Vincent Lambert? Tahun 2008, Vincent Lambert mengalami kecelakaan yang membuatnya mengalami kelumpuhan total dengan kesdaran diri yang minimum. Dokter mengatakan kerusakan otak yang dideritanya tak bisa disembuhkan. Ia dibiarkan hidup hanya dengan air dan makanan yang diberikan lewat pipa di perutya. Ia bisa bernapas tanpa alat bantu, dan sesekali bisa membuka mata. Rachel Lambert saat sedang menghadiri sidang di Pengadilan Hak Asasi Manusia Eropa untuk kasus suaminya, pada sidang bulan Januari 2015. Sesudah beberapa tahun berupaya memperbaiki keadaannya, tim medis Vincent menyarankan di tahun 2013 agar perawatan dihentikan - sesudah mereka berkonsultasi dengan istirnya, Rachel Lambert. Di bawah hukum Prancis, Rachel adalah wali hukum Vincent dan ia memastikan bahwa sebelum kecelakaan Vincent sempat mengatakan tidak ingin hidup dengan alat bantu. Dokter melakukan berbagai upaya untuk mencabut alat bantu hidupnya, tetapi karena tentangan orang tua Vincent, mereka harus melalui berbagai upaya hukum. Mengapa kasusnya ke pengadilan? Anggota keluarga Vincent Lambert tidak diajak berkonsultasi mengenai keputusan tim medis, maka mereka menentang saran pengakhiran hidup Vincent dalam pertarungan hukum yang panjang. Pihak yang mendukung adalah istrinya, enam orang saudara-saudarinya, dan seorang keponakan. Sementara orang tua Vincent, Pierre dan Vivianne - keduanya penganut Katolik yang taat - serta dua orang saudaranya berkeras bahwa perawatan Vincent harus tetap dilanjutkan. Orang tua Vincent Lambert, Pierre (kiri) dan Viviane yang berkampanye selama bertahun-tahun untuk mempertahankan hidup anak mereka. Pada puncak perseteruan di tahun 2015 orang tua Vincent mengedarkan sebuah video lewat kanal Katolik di situs YouTube yang memperlihatkan Vincent bereaksi terhadap anggota keluarganya. Dokter yang merawat memprotes video ini karena dianggap memberi informasi sesat tentang kondisi Vincent dan memanipulasi publik luas. Kasus Vincent kemudian meluas ke berbagai pengadilan, hingga ke Pengadilan Hak Asasi Manusia Eropa, (ECHR). EHCR mengukuhkan keputusan pengadilan Prancis yang memperbolehkan alat dukung hidup Vincent Lambert untuk dicabut. Meskipun begitu, ketika itu dokter tidak menjalankan keputusan tersebut di tengah kekhawatiran soal keamanan seiring ketakutan yang diungkapkan oleh Pierre Lambert bahwa ada rencana untuk menculik Vincent. Hak untuk banding ke pengadilan lebih tinggi pun sudah tidak ada lagi bagi pihak yang menentang, maka kemudian satu tim medis baru yang ditunjuk untuk menangani Vincent mulai mencabut alat dukung hidup untuknya. Hidup Vincent Lambert pun berakhir Kamis, 11 Juli 2019.",Seorang pria lumpuh menjadi simbol bagi perdebatan hak untuk mati di Prancis. Ia akhirnya meninggal dunia Kamis 11 Juli sesudah dokter mencabut pipa makanan - yang mempertahankannya hidup.
"PM Inggris peringatkan bahaya ekstrimis Islam.
PM Inggris David Cameron memperingatkan bahaya ekstrimisme yang dapat menodai demokrasi. David Cameron lantas memuji Indonesia yang disebutnya dapat membuktikan bahwa agama dapat berjalan seiring dengan demokrasi. ""Apa yang ditunjukkan Indonesia, membuktikan mereka mampu menolak ekstremisme, dan mampu memadukan agama dan demokrasi dapat berjalan bersama,"" kata David Cameron, Kamis (12/04) di aula kampus tersebut. Sebagai negara yang mayoritas penduduknya beragama Islam, David Cameron menegaskan, praktek demokrasi di Indonesia dapat dijadikan contoh bagi negara-negara Arab yang sedang mengalami perubahan. Dia kemudian memperingatkan bahaya yang mengintai negara-negara di kawasan Timur Tengah yang baru saja mengalami perubahan, seperti yang terjadi di Mesir, ketika kelompok ekstremisme sempat menganiaya kelompok minorotas. Islam agama damai Tetapi dalam pidatonya dia menekankan berulang-ulang, bahwa dia tidak membicarakan tentang Islam. ""Semua jelas, bahwa Islam adalah agama damai yang ajarannya ditaati lebih dari satu milyar pemeluknya di dunia,"" jelasnya. Ekstremisme, menurut Cameron, tidak hanya ditemukan di kalangan umat Islam, tetapi juga di semua kelompok agama. ""Dan mereka hanya didukung minoritas,"" tandas Cameron. David Cameron kemudian menjelaskan betapa berbahayanya ekstremisme: ""Ekstrimis - diantaranya menggunakan kekerasan - ingin memaksakan kehendaknya. Dan di dalam kelompok ekstrim Islam, mereka mengesampingkan pendapat orang lain. Penolakan mereka atas perbedaan dan demokrasi, seolah-seolah menunjukkan bahwa demokrasi dan Islam tidak berjalan seiring"". Namun, menurutnya, apa yang terjadi Indonesia membuktikan sebaliknya. ""Indonesia, sebagai negara yang penduduknya mayoritas menganut Islam, mampu menolak ekstremisme, dan mampu membuktikan bahwa Islam dan demokrasi dapat berkembang bersama. Itulah sebabnya, apa yang Anda lakukan di sini sangat penting"". Dalam pidatonya, Cameron mengatakan keputusan Indonesia mencantumkan penghargaan terhadap hak-hak individu dalam konstitusinya, ""sangat penting"" untuk melindungi kaum minoritas. Setelah berkunjung ke Jepang, pidato Cameron di Jakarta ini merupakan bagian dari rangkaian kunjungan kenegaraannya ke Indonesia, sebelum melanjutkan kunjungannya ke Malaysia. Rabu kemarin, Cameron melakukan pembicaraan dengan Presiden Susilo Bambang Yudhoyono, dengan agenda utama memperdalam kerjasama perdagangan dan bisnis.","Perdana Menteri Inggris David Cameron, dalam pidatonya di Universitas Al Azhar, Jakarta, mengatakan ekstremis Islam jangan diberi kesempatan untuk menodai demokrasi yang sedang berlangsung dan menganiaya kelompok minoritas."
"Serangan siber Wannacry di Indonesia 'bisa diantisipasi'.
Penyebaran ransonware wannacry terjadi di berbagai negara. Menteri Komunikasi dan Informatika, Rudiantara, menyebutkan sejumlah perangkat komputer di sejumlah perusahaan swasta dan satu kantor pelayanan publik Samsat diserang, tetapi bisa diatasi. ""Saya tidak punya angka persisnya tetapi yang dilaporkan ada Samsat, koorporasi di (pulau) Jawa ada juga perusahan perkebunan tapi tak banyak komputernya, tak lebih dari 10, karena pemerintah sangat gencar mengkomunikasikan ini,"" jelas Rudiantara kepada BBC Indonesia. Sejak penyebaran ransomware WannaCry di Indonesia akhir pekan lalu, Kominfo telah menyebarkan informasi keamanan siber kepada para pengguna internet melalui situsnya, media dan juga kerja sama dengan operator telepon seluler. Rudiantara mengklaim upaya sosialisasi cara penanganan ransomware Wannacry yang gencar sejak akhir pekan lalu, membuat tak banyak serangan di Indonesia. Ia menjelaskan di Kominfo ada ID SIRTII yang terdiri dari unsur Kominfo, praktisi, dan pakar dari perguruan tinggi yang bertugas mengatasi, memonitor, menangkal dan memulihkan ketika terjadi permasalahan siber. ""Dan proses yang kami jalankan, bersama-sama antara ID SIRTII dan komunitas yang lain, gandeng tangan untuk sosialisasi ke masyarakat Indonesia, sehingga dampaknya sangat minor,"" kata dia. Penyebaran ransomware Wannacry terjadi di sekitar 150 negara, termasuk Indonesia mulai pekan lalu. Program jahat ini dapat memasuki komputer tanpa disadari, lalu mengenkripsi data di dalamnya sehingga komputer tak dapat dipakai. Program jahat ini meminta 'tebusan' untuk memulihkan akses. Rudiantara mengatakan di Indonesia serangan siber tidak sebesar di negara lain seperti Inggris. Pada akhir pekan pemerintah menyebutkan ada dua RS yang terkena yaitu RS Dharmais dan RS Harapan Kita. Tetapi kemudian, manajemen RS Harapan Kita tidak terkena serangan siber. Pelayanan di RS Dharmais yang terkena serangan virus ransomware wannacry masih belum normal seluruhnya sampai Senin (15/05). Pantauan BBC pada Senin (15/05), pelayanan pasein di RS Dharmais sama dengan hari biasa, meski sedikit terhambat. Dirut Dharmais, Abdul Kadir, menjelaskan serangan terjadi Sabtu pukul 05.00 pagi. ""Pada saat itu, salah seorang petugas data entry kami di ruang rawat inap mau memasukkan data pasien rawat inap. Tiba-tiba terlihat tampilan di monitor itu berubah semua,"" jelas Abdul Kadir. ""Ia langsung melaporkan pada instalasi IT rumah sakit bahwa ada perubahan tampilan pada monitor komputer. Kemudian ia diinstruksikan untuk menghentikan semua proses di IT dan mematikan semua komputer yang ada di ruangan itu,"" tambah dia. Abdul Kadir memastikan data pasien di RS Dharmais masih aman. Komputer yang terkena wannacry akan menyedot data komputer dan meminta sejumlah tebusan. Pengamat keamanan internet dari Vaksincom, Alfons Tanujaya, mengatakan serangan ransomware Wannacry melemah karena memiliki perisai pembunuh (Kill Switch), sehingga melemah sendiri. Namun, Alfond mengatakan peristiwa ini membuat orang di Indonesia menjadi sadar akan keamanan siber. ""Kabar baiknya tanpa antisipasi malware bisa mati sendiri. Tapi mungkin kita ambil positifnya, mereka melakukan backup,"" katanya. Dikatakan, komputer yang diserang menggunakan sistem operasi Windows XP yang mungkin karena tidak diperbarui, ada celah yang bisa dibobol ransomware. Alfons mengatakan sebagian besar pengguna internet di Indonesia masih membutuhkan edukasi tentang keamanan siber agar tak mudah terkena serangan. Ia juga mengatakan Indonesia termasuk negara yang masih lemah untuk mengatasi serangan siber. ""Ini tak mudah ... ada korelasi penggunaan piranti lunak bajakan dengan celah keamanan yang tidak ter-update. Kita perlu edukasi,"" jelas Alfons. Sampai saat ini, untuk keamanan siber pemerintah masih memprioritaskan pada tiga sektor penting, yaitu keuangan (perbankan), transportasi dan energi dengan melakukan standardisasi dan sosialisasi di sektor. Pemerintah juga tengah mempersiapkan Badan Siber Nasional untuk menangkal dan mengatasi serangan siber. ""Badan siber ini multisektor, ada Kominfo, Lembaga Sandi Negara dan lembaga lain ... akan membuat kebijakan satu pintu dan lebih terkoordinir tugasn,"" kata Rudiantara.","Pemerintah mengatakan serangan siber masih ditemukan di Indonesia pada Senin (15/05) dalam skala kecil, meski begitu pemerintah terus melakukan upaya mengatasi serangan siber."
"Dan Brown terbitkan kisah baru Robert Langdon, Inferno.
Novel Dan Brown telah terjual jutaan kopi di seluruh dunia Berjudul Inferno, buku itu akan menjadi novel keempat dalam seri kriminal dengan tokoh pakar simbol Harvard Robert Langdon. Brown mengatakan ia terpengaruh oleh karya klasik penyair Italia Dante, Inferno, saat melakukan riset di Florence. Berlatarbelakang di Italia, buku itu akan mengisahkan petualangan Langdon di ""dunia mengerikan yang berpusat pada salah satu mahakarya sastra yang paling abadi dan misterius."" ""Meski saya mempelajari Inferno karya Dante saat masih menjadi mahasiswa, tapi saya baru dapat menghargai pengaruh abadi karya Dante di dunia modern,"" kata Brown. ""Dengan novel baru ini, saya sangat bersemangat membawa para pembaca dalam sebuah perjalanan ke dalam dunia misterius...sebuah lansekap kode, simbol dan lebih dari sekedar beberapa jalan rahasia."" Simbol rahasia Judul novel tersebut diungkap melalui situs-situs media sosial termasuk Twitter dan Facebook. Setiap kali penggemar menyebut novel itu, sebuah mosaik terbuka dan akhirnya mengungkapkan judulnya. Gambar itu menunjukkan Basilika Santa Maria yang juga dikenal sebagai Duomo di Florence. Ini bukan pertama kalinya teka teki digunakan sebagai bagian kampanye pemasaran novel-novel Brown. Serangkaian kode, teka teki dan petunjuk dirilis bertepatan dengan peluncuran novel terakhirnya, The Lost Symbol. Novel Langdon telah terjual jutaan kopi di seluruh dunia. The da Vinci Code telah diterjemahkan dalam 51 bahasa. Baik The Da Vinci Code dan Angels and Demons telah diangkat ke layar lebar di Hollywood dan tokoh Robert Langdon diperankan oleh Tom Hanks. Versi film The Lost Symbols masih dalam proses.","Dan Brown, penulis novel laris The Da Vinci Code, akan menerbitkan buku barunya bulan Mei mendatang."
"Komnas HAM segera selidiki pembunuhan Salim Kancil.
Komnas HAM akan mengumpulkan bukti dan saksi terkait kematian Salim. Dalam kesempatan itu Komnas HAM akan mengumpulkan bukti, dokumen dan keterangan dari sejumlah pihak, termasuk korban, saksi, Kepolisian, Bupati Lumajang dan Perhutani. ""Ini jelas kejahatan terhadap kemanusiaan. Komnas HAM menerima laporan selama ini ada tiga korban jiwa,"" ujar Wakil Ketua Komnas HAM, Siti Noor Laila sebagaimana dilaporkan wartawan Eko Widianto dari Lumajang. Komnas HAM juga akan menginvestigasi dugaan pembiaran oleh aparatur negara dan pemerintah. Sebab sebelum kejadian penganiayaan yang menyebabkan Salim alias Kancil tewas dan Tosan luka parah, mereka telah melaporkan adanya ancaman pembunuhan terhadap mereka ke polisi. ""Jika polisi bergerak tak perlu ada korban jiwa. Terkesan negara tidak hadir. Memberikan hak hidup aman,"" ujarnya. Pada 9 September 2015, sejumlah aktivis antitambang menerima ancaman pembunuhan. Mereka melaporkan secara tertulis ke Kepolisian Resor Lumajang. Namun, Kepolisian Resor Lumajang baru mengeluarkan perintah untuk menyidik perkara tersebut. Dugaan penyuapan Sementara itu, pada hari Jumat (02/10) Kapolda Jawa Timur Inspektur Jenderal Anton Setiadi mengumumkan bahwa dua personil polisi diduga menerima suap dalam kasus penambangan pasir. ""Anggota menerima sesuatu, dan akan dibuktikan. Sekarang dalam penyelidikan lebih lanjut,"" ujar Anton. Soal dugaan itu, Kepala Kepolisian Resor Lumajang, Ajun Komisaris Besar Fadly Munzir Ismail mengatakan dirinya juga siap diperiksa. ""Saya juga siap diperiksa, jika terbukti akan ada sanksi internal,"" katanya. Petani bernama Salim alias Kanci tewas karena diduga dianiaya dengan senjata tajam, dan dipukul dengan batu di depan Balai Desa Selok Awar-Awar, Sabtu 26 September 2015. Salim kemudian meninggal dunia. Di tempat terpisah, Tosan, petani lain yang juga merupakan penentang aktivitas penambangan, mengalami luka berat yang diduga merupakan akibat dari siskaan.","Komisi Nasional Hak Asasi Manusia pada hari Senin (05/10) akan menyelidiki perkara penganiayaan dan pembunuhan aktivis antitambang bernama Salim alias Kancil di Desa Selok Awar Awar, Kecamatan Pasirian, Kabupaten Lumajang."
"India selidiki alkohol beracun setelah 42 orang meninggal.
Polisi mengatakan minuman alkohol beracun dicampur dengan pestisida. Puluhan orang dirawat di rumah sakit dan para pejabat mengatakan mereka memperkirakan jumlah korban meninggal akan meningkat. Polisi mengatakan mereka menggrebek sejumlah tempat dan menahan 12 orang. Mereka mengatakan minuman alkohol itu dicampur dengan bahan kimia sehingga menjadi beracun. Kematian karena minuman alkohol yang terkontaminasi sering terjadi di India. Minuman alkohol buatan yang disebut desi daroo di India biasanya hanya sekitar 10 rupee (Rp2.000) dan mayoritas konsumen adalah warga kurang mampu. Dikremasi keluarga Polisi mengatakan keluarga mengkremasi korban tanpa pemberitahuan. Bahan kimia dan pestisida sering dicampur ke alkohol untuk meningkatkan rasa dan dapat menyebabkan kejang, muntah-muntah dan kematian. Penduduk di delapan desa di kawasan Mubarakpur di Azamgarh menenggak minuman alkohol ilegal ini Jumat (18/10) lalu dan setelah itu jatuh sakit, kata polisi. ""Paling tidak 42 orang meninggal di rumah sakit namun kami perkirakan jumlah korban akan meningkat karena banyak jenazah yang dikremasi keluarga tanpa memberitahu polisi atau petugas medis,"" kata petugas medis di Azamgarh, BB Singh, kepada BBC. Polisi menggrebek sejumlah tempat dan menahan 12 orang. Sejumlah korban ada yang buta setelah menenggak campuran minuman beracun itu, kata para pejabat. Enam polisi dan lima pejabat dari dinas bea cukai dipecat dari pemerintah negara bagian karena diduga terlibat. Puluhan orang dirawat di rumat sakit setelah menenggak campuran minuman beracun. Dalam kasus keracuan alkohol Desember 2011, sekitar 169 orang meninggal di Benggala Barat, sementara 109 orang meninggal di Gujarat Juli 2009. Hampir 200 orang meninggal di Orissa tahun 1992 setelah menenggak alkhohol yang dicampur methyl dan ethyl. Gujarat telah meloloskan undang-undang yang melarang penjualan dan pembuatan alkohol beracun. Hukuman maksimal mereka yang terlibat adalah hukuman mati. Pemerintah daerah Gujarat mengatakan undang-undang itu dimaksudkan sebagai efek jera bagi yang terlibat dalam perdagangan ilegal. Selain Gujarat, negara bagian lain yang melarang minuman beralkohol adalah Mizoram dan Nagaland.",Para pejabat India mulai melakukan penyelidikan setelah paling tidak 42 orang meninggal setelah menenggak alkohol beracun di Uttar Pradesh.
"Kejutan laba Panasonic akibat lemahnya yen.
Persaingan di pasar televisi dan perabot listrik global sangat ketat saat ini. Jumat (1/2) lalu Panasonic melaporkan lonjakan keuntungan senilai 61,3 miliar yen (sekitar Rp6,4 triliun) sepanjang Oktober-Desember, padahal tahun sebelumnya pada periode yang sama perusahaan terkemuka Jepang itu memanggul kerugian 197,6 miliar yen (sekitar Rp20,6 triliun). Dalam ramalan bisnisnya Panasonic sebelumnya menyatakan sepanjang tahun masih akan terus merugi dengan nilai kerugian 765 miliar yen hingga 31 Maret pada tahun 2013. Tetapi karena rendahnya mata uang yen, maka keuntungan mulai masuk dan kondisi bisnisnya dipandang mulai membaik. Keuntungan ini menjadi dasar analisis sejumlah pengamat yang menyebut investor mengharapkan lemahnya nilai yen berlanjut agar keuntungan terus mengalir pada kuartal pertama tahun ini. Strategi baru ""Saat ini bisnis Panasonic tertolong oleh nilai mata uang yang rendah dan kelihatannya untuk kuartal keempat kinerja mereka masih berlanjut baik,"" kata Yuki Sakurai analis pasar dari Fukoku Capital Management kepada BBC. Secara keseluruhan mata uang yen sudah melemah lebih dari 15% terhadap dollar AS sejak November lalu. Perusahaan eksportir seperti Panasonic sangat tertolong dengan melemahnya nilai tukar ini karena harga barang bikinan Jepang menjadi lebih murah di pasar luar negeri. Kemalangan Panasonic dimulai sejak merebaknya krisis ekonomi global serta makin turunnya harga TV. Kompetisi produk serupa juga sangat ketat terutama dari merek asal Korea Selatan, Samsung yang kini memimpin pasar TV dunia. Panasonic menyatakan konsumsi global TV layar datar dan peralatan digital sudah makin turun. Angka penjualan melorot 8% tahun lalu dan situasi ini menurut pengamat menunjukkan pentingnya Panasonic mencari terobosan baru agar tetap dapat bertahan dalam bisnis.","Saham Panasonic melonjak 17% menjadi 692 yen di bursa saham Tokyo, setelah perusahaan pembuat TV dan perabot listrik itu kembali menghasilkan laba pada kuartal ketiga tahun lalu."
"Pencari suaka klaim Australia ledakkan kapal.
Kapal pencari suaka yang dihentikan di Tanjung Benoa, Bali, pada 2013 Dalam pernyataan yang dikutip AP, Badan SAR Nasional (Basarnas) mengatakan mereka menyelamatkan para pengungsi setelah armada Angkatan Laut menemukan sekoci yang terombang ambing di dekat pantai Agropeni di Kebumen, Jawa Tengah. Para pengungsi yang berasal dari Pakistan, Bangladesh, Nepal dan Iran ditampung di kantor imigrasi setempat di dekat Cilacap, kata Imam Prawira, kepala penyidikan dan penindakan kantor imigrasi setempat. Prawira mengatakan, menurut seorang pengungsi asal Pakistan, mereka sudah mendekati perbatasan laut Australia ketika aparat memindahkan mereka ke sekoci. Sementara itu, kepolisian Kebumen mengatakan menangkap tiga awak kapal berkebangsaan Indonesia tetapi satu orang melarikan diri ketika diinterogasi. 'Tak bisa tenggelam' Awak kapal tersebut mengaku baru menerima upah Rp10 juta dari total Rp30 juta yang dijanjikan para pencari suaka begitu mereka tiba di Australia, kata Warsidi dari Kepolisian Kebumen. Para pencari suaka, menurut polisi, bertolak dari Jawa Barat menuju Pulau Christmas di Australia pada Rabu pekan lalu. Tiga hari kemudian mereka tiba di perbatasan tapi kedatangan mereka terdeteksi kapal perang Australia yang kemudian meledakkan kapal mereka. Australia membeli sekoci yang diklaim ""tidak bisa tenggelam"" untuk mencegah gelombang pencari suaka tapi pemerintah negara itu menolak mengkonfirmasi laporan bahwa sekoci digunakan untuk mengirim pengungsi ke Indonesia. Polisi mengatakan sekoci itu dilengkapi dengan televisi, alat navigasi, baterai dan makanan.","Dua puluh enam orang pencari suaka yang terdampar di Indonesia mengatakan aparat Australia meledakkan kapal mereka di dekat Pulau Christmas dan mengirim mereka kembali ke perairan Indonesia dengan sekoci, kata seorang pejabat Indonesia."
"Karya seni korban bom nuklir Hiroshima.
Lukisan ini berjudul 'Rumah Sakit' dan dilukis oleh Fumiko Ya Lukisan-lukisan yang menggambarkan situasi pasca ledakan bom itu akan dipertontonkan di Manchester Art Gallery bulan depan. Karya-karya seni itu merupakan kenangan korban akan apa yang terjadi pada 6 Agustus 1945, ketika bom atom pertama dijatuhkan dari pesawat AS dalam Perang Dunia II. Lukisan itu dibuat atas permintaan badan penyiaran Jepang NHK pada 1970. Korban bom nuklir Hiroshima dan Nagasaki diperkirakan mencapai 60.000-80.000 orang. Namun jika dihitung dengan korban yang meninggal dunia akibat penyakit radiasi, maka korban mencapai lebih dari 135.000 jiwa. Bom Hiroshima mengakhiri Perang Dunia II Jepang menyebut korban radiasi sebagai 'hikushiba' Lukisan-lukisan akan dipamerkan di Manchester Art Gallery",Karya seni korban yang selamat dari bom atom Hiroshima pada 1945 akan dipamerkan di luar Jepang untuk pertama kalinya.
