article,summary
"Lukisan bunga Van Gogh terjual US$61,8 juta.
Still Life, Vase with Daisies, and Poppies dibuat beberapa bulan sebelum van Gogh meninggal. Still Life, Vase with Daisies, and Poppies melampaui perkiraan sebelumnya US$50 juta pada pelelangan di Sotheby. Lukisan Van Gogh dibuat di rumah dokter Prancisnya hanya beberapa bulan sebelum dirinya meninggal di tahun 1890. Karyanya ini adalah satu dari beberapa lukisannya yang terjual saat Van Gogh masih hidup. Rekor penjualan pelukis Belanda pada balai lelang adalah US$82,5 juta lewat Portrait of Dr Gachet. Lukisan tentang dokternya ini terjual pada tahun 1990. Pada pelelangan ini patung Alberto Giacometti dari tahun1951 terjual seharga lebih dari US$100 juta, di bawah rekor karya seniman Swiss itu senilai US$104,3 juta. Sementara pematung Amedeo Modigliani mencatat rekor baru lewat Tete patung kepala yang dibuat di tahun 1911-1912 dari batu kapur terjual lebih US$70 juta.","Sebuah mahakarya Vincent van Gogh, yang dilukis pada akhir kehidupannya, terjual di New York sebesar US$61,8 juta atau Rp752 miliar."
"Mengapa pengungsi Suriah diminta segera meninggalkan Istanbul, kota terbesar di Turki?.
Foto tanggal 6 Agustus ini memperlihatkan keluarga sedang berpisah sebelum naik ke bus yang akan membawa mereka kembali ke Suriah. Pihak berwenang mengatakan migran tak terdaftar harus segera kembali ke lokasi tempat pendaftaran mereka, sebagai upaya untuk mengurangi tekanan terhadap kota Istanbul. Namun beberapa migran Suriah ini mengatakan banyak dari mereka yang dideportasi ke Idlib di Suriah - di mana peperangan masih berlangsung sengit. Mereka berkata banyak yang dipaksa menandatangani dokumen untuk dipindahkan secara sukarela, padahal mereka tak bisa membaca atau tak mengerti dokumen itu. Perintah untuk pindah diumumkan akhir Juli, yang memberi mereka waktu sebulan untuk pindah. Sekitar setengah juta orang Suriah terdaftar di Istanbul, tetapi menurut perkiraan yang tinggal di sana dua kali lipatnya, berasal dari provinsi-provinsi lain tempat mereka didaftar ketika masuk ke Turki. Gubernur Istanbul mengatakan orang Suriah yang berhak untuk berada di Istanbul harus membawa paspor dan dokumen identitas mereka setiap saat. Ia juga mengumumkan adanya pengecekan di stasiun bus dan kereta. Turki mulai menutup diri? Menurut wartawan BBC di Istanbul Mark Lowen, Turki selama ini bangga akan reputasinya menerima 3,6 juta pengungsi Suriah - yang terbesar di dunia. Namun kesabaran mereka tampaknya menipis. Awal Agustus sekitar 12.000 migran telah dipindahkan ke provinsi di mana mereka terdaftar pertama kalinya. Sekitar 2.600 yang tak terdaftar di tempatkan di pusat penampungan yang dikelola Kementerian Dalam Negeri. Ribuan tempat kerja disidak untuk ""mencegah tenaga kerja tak terdaftar"". Jajak pendapat menunjukkan turunnya dukungan terhadap pengungsi Suriah, dari 70% ke 40%, dan ini dipandang sebagai salah satu faktor yang membuat partai Presiden Erdogan kehilangan kekuasaan di Istanbul dalam pemilu lokal tahun ini. Polling opini memperlihatkan menurunnya dukungan terhadap pengungsi Suriah di Turki. Pemerintah Turki mengatakan pengungsi yang ingin kembali ke Suriah dipindahkan ke wilayah aman yang berada di bawah kendali militer Turki. Menurut pemerintah Turki, serangan udara pemerintah Suriah terhadap iring-iringan kendaraan Turki telah menyebabkan tiga penduduk sipil meninggal dunia dan melukai 12 lainnya. Kawasan itu seharusnya dilindungi sebagai ""zona penyangga"" yang telah disepakati tahun lalu. Namun pemerintah Suriah telah meningkatkan serangan dalam beberapa bulan terakhir.",Ribuan pengungsi Suriah punya waktu hingga Selasa (20/08) untuk meninggalkan Istanbul atau mereka akan dipindahkan dengan paksa dari kota terbesar di Turki itu.
"Para pemain Chapecoense akan dikenang selamanya sebagai 'juara abadi'.
Para keluarga korban berada di tengah fan yang berkumpul di stadion Arena Conda di Chapeco. Chapecoense bertolak ke Kolombia untuk turun dalam leg pertama final Piala Amerika Selatan, Copa Sudamericana, melawan Atletico Nacional. Pesawat jatuh hari Senin (28/11) dan menewaskan 71 orang. Melalui akun Facebook, Chapecoense menyebut mereka adalah 'juara abadi'. ""Hari ini, kita terbangun dengan tantangan baru. Hidup mengajarkan kita pelajaran baru. Pejuang kita menjadi pahlawan. Kehidupan mereka menjadi abadi...Anda selalu akan menjadi juara,"" begitu kutipan Chapecoense. Foto terakhir: Pemain Marcos Danilo Padilha dan Alan Ruschel memasang foto di media sosial sebelum bertolak. Enam dari 77 orang dalam pesawat itu selamat. Tidak jelas apa yang menyebabkan pesawat itu jatuh, namun laporan yang belum dapat dikonfirmasi menyebutkan terjadi kerusakan listrik, dan laporan lain menyebut pesawat itu hampir kehabisan bahan bakar. Awak pesawat carter, Ximena Suarez, yang selamat, mengatakan, ""lampu mati dan saya tak ingat apa-apa lagi setelah itu."" Dongeng yang berakhir tragis Sekitar 10.000 orang yang berkumpul di stadion Arena Conda Selasa malam (29/11). Mereka di antaranya adalah para pendukung yang mengenakan seragam hijau dan putih dengan meneriakkan nama-nama pemain dan seruan ""juara."" Keluarga para pemain saling berpelukan di lapangan. Anggota tim sepak bola yang selamat termasuk pemain belakang Alan Ruschel dan Helio Zemper, serta penjaga gawang cadangan Jakson Follman. Chapecoense berada di divisi empat pada 2009, namun meningkat pesat prestasinya dan menjadi salah satu tim kuat pada tingkat nasional. Wartawan BBC Brasil Fernando Duarte mengatakan, ""Cerita mereka adalah kisah dongeng fantastis yang berakhir dengan tragis."" Dunia sepak bola memberikan penghormatan termasuk pemain Chelsea asal Brasil, David Luis. Salah satu rekan Luis ketika masih di klub Vitoria termasuk pemain yang meninggal. Tim sepak bola di Brasil mengatakan mereka akan meminjamkan pemain secara gratis untuk Chapecoense sehingga mereka tetap bisa melanjutkan bermain sebagai klub. Para pemain Chapecoense, klub yang naik ke divisi utama pada 2014. Chapecoense juga diminta untuk tetap di divisi utama selama tiga tahun. Klub dari Brasil selatan ini dibentuk tahun 1973 dan naik ke divisi utama negara itu tahun 2014. Penghormatan klub-klub dan pemain dunia Kemenangan dalam dua leg untuk kejuaraan regional akan membuat Chapecoense masuk kualifikasi Copa Libertadores, kejuaraan utama Amerika Selatan. Konfederasi Sepak Bola Brasil mengumumkan hari berkabung selama seminggu, dengan ditundanya semua pertandingan. Pemerintah Brasil sendiri telah mengumumkan tiga hari berkabung secara nasional. Presiden dalam komite pelindung Chapecoense, David de Nes Filho, menyebut klub ini ""bukan hanya grup yang dibangun dengan saling menghargai namun seperti keluarga."" ""Kami sangat berbahagia. Sebelum naik pesawat, mereka mengatakan akan membuat mimpi menjadi kenyataan. Mimpi itu berakhir pagi ini,"" kata Nes Filho setelah mendengar berita kecelakaan pesawat. Klub-klub sepak bola dunia termasuk Chelsea, Barcelona dan Real Madrid memberikan penghormatan kepada para korban selama latihan dan juga mengheningkan cipta dalam pertandingan perempat final Piala EFL di Inggris Selasa (29/11). Para pemain bola, dari Barcelona termasuk Lionel Messi dan Neymar dan pemain Manchester United, Rayne Rooney, juga memberikan penghormatan kepada para pemain Chapecoense. Sepak bola Brasil berduka. Kehilangan besar. Duka cita saya untuk keluarga korban. Berisitirahat dengan tenang, tulis Pele. Berita duka saat bangun hari ini, tulis Wayne Rooney Neymar menggunakan tagar #ForcaChape yang populer di media sosial, yang berarti kekuatan Chape, julukan klub itu.","Ribuan orang berkumpul di kota Chapeco, Brasil, untuk mengenang korban jatuhnya pesawat, yang sebagian besar adalah anggota tim sepak bola kota tersebut, Chapecoense."
"Kelompok Kurdi TAK klaim mengebom Ankara.
Disebutkan oleh TAK bahwa korban sipil tak bisa dihindari dalam serangannya. Dalam pernyataan yang dirilis online, TAK mengatakan serangan yang menewaskan 37 orang tersebut merupakan pembalasan atas operasi militer di wilayah Turki tenggara yang mayoritas penduduknya Kurdi. ""Pada malam tanggal 13 Maret, pengeboman bunuh dilakukan ... di jalan-jalan ibu kota Republik Turki yang fasis. Kami mengklaim serangan ini,"" kata TAK dalam situsnya. Lebih lanjut disebutkan oleh TAK bahwa meskipun serangan ditujukan kepada aparat keamanan, korban sipil mungkin tak bisa dicegah. TAK adalah kelompok yang tumbuh dari Partai Pekerja Kurdi (PKK) yang sudah dilarang oleh pemerintah Turki. Sebelum muncul pengakuan TAK, pihak berwenang menyalahkan PKK atas pengeboman di Ankara. Sejauh ini aparat keamanan menahan 11 orang terkait dengan serangan itu. Dalam perkembangan terpisah, pemerintah Jerman mengatakan menutup kedutaannya di Ankara karena muncul indikasi akan adanya serangan. Jerman juga menutup konsulat dan sekolahnya di Istanbul.","Kelompok militan Kurdi TAK mengatakan pihaknya melancarkan serangan mematikan di ibu kota Turki, Ankara, pada Minggu (13/03)."
"Virus corona: Sejumlah dokter di India ‘diludahi dan dilempari batu’ saat perangi Covid-19.
Para dokter di India bekerja lembur untuk menghentikan penyebaran virus corona. Beragam laporan menyebutkan beberapa dokter diludahi dan diusir dari rumah warga yang diduga mengidap Covid-19. Dalam salah satu kasus bahkan sejumlah pasien melontarkan makian kotor ke perawat-perawat perempuan. Ada pula laporan beberapa dokter dan keluarga mereka dikucilkan para tetangga karena dokter-dokter tersebut menangani pasien yang terinfeksi Covid-19. Di India sejauh ini terdapat lebih dari 3.500 kasus dan sedikitnya 99 orang meninggal dunia, sebagaimana tercatat dalam data Universitas Johns Hopkins, Amerika Serikat. Sebuah video yang kini viral memperlihatkan kerumunan massa melempari dua dokter perempuan dengan batu di Kota Indore. Kedua dokter yang memakai alat pelindung diri (APD) itu disebut diserang saat berkunjung ke sebuah kawasan padat penduduk guna memeriksa seorang perempuan yang diduga mengidap Covid-19. Walau mengalami cedera, salah seorang dokter dalam video itu, Zakiya Sayed, mengatakan insiden tersebut ""tidak akan menghalangi saya melakukan tugas"". ""Kami sedang melakukan tugas rutin untuk memeriksa kasus-kasus suspect. Kami tidak mengira kami akan diserang."" ""Saya tidak pernah melihat adegan seperti itu, menakutkan. Entah bagaimana kami bisa melarikan diri dari kejaran massa. Saya cedera namun tidak takut sama sekali."" Dr Sayed menambahkan: ""Kami tidak punya alasan untuk curiga bahwa orang-orang akan terusik oleh tim medis."" ""Kami bekerja agar orang-orang sehat. Sebelumnya kami punya informasi mengenai seseorang yang berkontak dengan pasien Covid-19. Kami sedang bicara dengan orang itu ketika warga terusik dan menyerang kami."" (Foto ilustrasi) Sejumlah laporan menyebutkan beberapa dokter mengalami beragam serangan di India. Sebanyak tujuh orang telah ditahan aparat atas keterkaitan mereka dengan insiden itu. Dr Anand Rai, yang merupakan bagian dari gugus tugas Covid-19 di Indore, mengatakan kepada BBC: ""Tidak ada yang bisa membenarkan serangan terhadap tim medis. Namun itu terjadi di kawasan mayoritas Muslim, di mana secara umum ada ketidakpercayaan kepada pemerintah."" Dia mengatakan, area itu baru-baru ini menjadi saksi demonstrasi menentang undang-undang kewarganegaraan yang anyar. ""Sehingga kemarahan meluap dan diwujudkan dalam serangan ini. Namun, apapun alasannya, tidak ada yang bisa membenarkan aksi kekerasan, khususnya terhadap dokter dalam darurat kesehatan nasional,"" paparnya. GEJALA dan PENANGANAN: Covid-19: Demam dan batuk kering terus menerus TIPS TERLINDUNG DARI COVID-19: Dari cuci tangan sampai jaga jarak PETA dan INFOGRAFIS: Gambaran pasien yang terinfeksi, meninggal dan sembuh di Indonesia dan dunia VAKSIN: Seberapa cepat vaksin Covid-19 tersedia? Sementara itu, sebuah rumah sakit di Kota Ghaziabad di bagian utara India juga menjadi tempat kericuhan pada Kamis (02/04). Rumah sakit itu menempatkan setidaknya 21 orang di karantina setelah mereka menghadiri acara Jamaah Tabligh yang dikaitkan dengan ratusan kasus positif corona di India. Di rumah sakit Ghaziabad, beberapa orang yang dikarantina dituding menggunakan kata-kata makian kotor ke sejumlah perawat. Hampir 400 kasus Covid-19 terlacak asal-usulnya ke pertemuan Jamaah Tabligh di Delhi. ""Beberapa orang berjalan telanjang di bangsal rumah sakit serta melecehkan dokter-dokter dan perawat perempuan,"" papar seorang dokter yang bekerja di rumah sakit itu kepada BBC. ""Mereka terus meminta rokok dan tembakau."" Seorang perwira senior polisi di kota tersebut memaparkan kepada BBC bahwa sejumlah dokter telah mengadukan kasus pidana. ""Mengadukan kasus adalah pilihan terakhir. Polisi masih berupaya membuat mereka memahami keparahan situasi ini,"" ujarnya. Para dokter dan perawat meminta masyarakat mengikuti arahan dan tidak panik. Insiden-insiden serupa dilaporkan terjadi di ibu kota India, Delhi. Sejumlah peserta pertemuan Jamaah Tabligh yang berada di fasilitas karantina yang dikelola perusahaan kereta api disebut-sebut meludahi beberapa dokter. Deepak Kumar, juru bicara perusahaan Northern Railways, mengatakan situasi sudah terkendali. ""Para peserta sudah diberi pengarahan dan kini mereka bekerja sama dengan para staf,"" katanya. Pemerintah daerah Delhi dilaporkan telah menulis surat kepada polisi, berisi permintaan tambahan keamanan untuk staf medis. Laporan mengenai serangan terhadap dokter dan perawat juga datang dari Kota Hyderabad di selatan dan Kota Surat di barat. Seorang dokter yang menangani pasien-pasien Covid-19 di Rumah Sakit Gandhi di Hyderabad dilaporkan diserang pada Rabu (01/04). Polisi telah berjanji kepada sang dokter bahwa ""tindakan tegas akan diambil terhadap pelaku-pelaku"". Perdana Menteri Narendra Modi menjuluki para dokter sebagai ""prajurit-prajurit di garis depan"". Akan tetapi, serangan dan hinaan terhadap tenaga kesehatan tidak hanya terjadi di tempat kerja. Seorang dokter, yang tidak ingin identitasnya dipublikasikan, mengaku merasa ""sangat sedih ketika saya tahu bahwa tetangga-tetangga berpikir saya dan keluarga saya seharusnya tidak diperbolehkan tinggal di dalam gedung"". ""Kami ingin keluarga kami aman. Namun kami didiskriminasi karena melakukan pekerjaan kami."" ""Sejumlah dokter telah teruji positif di seantero India dan itu menunjukkan betapa sulitnya pekerjaan kami pada saat itu. Dan itu sebabnya kami memerlukan sokongan semua orang untuk memenangi peperangan melawan virus corona."" Ditambahkannya: ""Kami mengikuti semua protokol kesehatan. Kami bahkan tidak bertemu dengan keluarga kami dan itu membuat stres."" ""Namun menyaksikan diskriminasi secara terbuka benar-benar membuat hancur hati saya. Meski begitu, saya akan terus berjuang karena tidak ada pilihan lain.""",Sejumlah tenaga kesehatan di India dilaporkan mengalami serangan dari anggota masyarakat selagi berupaya menghentikan penyebaran virus corona.
"Kama Sutra kuno dari Arab.
Hingga kini buku Seribu Satu Malam masih laris manis di toko buku Jauh sebelum orang-orang seperti Nabokov dan Nin, dan sebelum The Joy of Sex terkenal, ada Kama Sutra, teks Sansekerta kuno yang ditulis oleh Vãtsyãyana dan sering dianggap sebagai buku seks yang sangat bagus. Bahkan bagi mereka yang sopan dan tidak tahu apa-apa di Ars Amatoria - elegi tentang hubungan pria dan wanita yang ditulis oleh Ovid pada abad ke-2 sebelum Masehi, Kama Sutra sudah sangat populer. Buku tipis yang dibuat oleh Vãtsyãyana ini hampir identik dengan erotika. Meski memiliki status legendaris, bagaimanapun, ada beberapa yang menganggapnya sedikit lebih dari hiburan. 'Bergeraklah, kamu yang indah, berhias permata bertelanjang dada,"" mereka mungkin berkata, sambil menatap miniatur Mughal yang menggambarkan adegan menggairahkan dalam buku itu, 'dan berilah jalan untuk si Syeikh!' Selain terjemahannya tentang Kama Sutra yang terkenal, petualang orientalis Sir Richard Francis Burton juga memperkenalkan kepada pembaca bahasa Inggris teks abad ke-15 yang ditulis oleh Syeikh Nefzaoui dari Tunisia yang dikerjakan dari terjemahan bahasa Prancis pertama dari buku berbahasa arab itu. Perfumed Garden menyajikan serangkaian cerita, yang semuanya berhubungan dengan (secara gamblang) praktik bercinta -atau, sebagaimana terjemahan Burton dengan gembira merujuknya ,""persetubuhan!"" Berbeda dengan Kama Sutra, yang beberapa orang mungkin memandangnya edukatif, The Perfumed Garden, selain mengajarkan pembaca mengenai berbagai topik, seperti alternatif untuk pembauran alat kelamin laki-laki dan ""segala sesuatu yang menguntungkan"" terkait seks, juga memberi penekanan yang berat pada hiburan. Cerita-ceritanya dipaparkan dengan cara yang sangat hidup seperti yang terjadi pada cerita Seribu Satu malam dan orang mungkin berpendapat bahwa deskripsi eksplisit di buku tersebut tentang semua perilaku hubungan seksual bisa membuat Vãtsyãyana malu. Naskah manuskrip Prancis yang menjadi referensi Burton memuat 21 bab tentang homoseksualitas dan aktivitas seksual antara pria dan bocah laki-laki yang tidak ada dalam edisi yang sudah ada, yang pasti akan dinikmati oleh Petronius. Menurut berbagai catatan, Burton bermaksud untuk memasukkannya dalam edisi revisi, berjudul The Scented Garden; namun ia meninggal sebelum bisa melakukannya, dan edisi yang tidak disensor ini -bersama degan banyak tulisan Burton yang lain - kemudian dibakar oleh istrinya Isabel. Petualang orientalis asal Inggris, Sir Richard Burton menerjemahkan kisah erotis dari dunia Arab pada abak ke-15 'Spektrum mispersepsi' Saat ini, di dunia Arab yang sering digambarkan sebagai zona bebas seks dan dimana subjek seks sangat tabu, karya-karya seperti The Perfumed Garden mungkin tampak aneh oleh kebanyakan atau paling tidak satu per satu. Buku-buku semacam itu - ""penuh dengan deskripsi seks yang menggembirakan dan sangat eksplisit"" - bahkan mendapat berkah dari surga, menurut akademisi Sarah Irving: ""Jauh dari semacam pornografi bawah tanah Arab di zaman abad pertengahan,"" tulisnya di blog ArabLit, ""buku-buku erotis ini disetujui secara religius, saran-saran yang ada di buku ini dipandang sebagai bagian dari berkah Tuhan kepada umat manusia"". Di ujung lain dari spektrum mispersepsi mengenai masalah ini adalah penggambarannya oleh orientalis (dalam pengertian Saidian) sebagai taman bermain seksual, tempat fantasi dunia Barat berjalan liar. Di dunia Arab yang hiper-seksual yang mereka bangun, Flaubert membual tidur dengan penari Mesir Kuchuk Hanem. Kemudian ""Orang Turki yang penuh hawa nafsu "" (orang Aljazair, sebenarnya) mendapati daging tambahannya diiris dan diawetkan dengan aman dengan cara yang bahkan Sada Abe akan setujui. Kedua gagasan tentang dunia Arab -sebagai sesuatu yang steril dan seks yang berlebihan- tentu saja yang sudah bias; tapi itu adalah bagian yang mungkin lebih lucu, terutama mengingat cara seks telah dibahas dalam budaya Arab selama ini. Kembali beralih ke Burton, The Perfumed Garden dapat dibilang ditempatkan bersama sastra klasik Arab seperti Seribu Satu Malam (Alf Layla wa Layla), dimana Burton juga membuat terjemahannya yang sangat terkenal. Dengan judul yang menyesatkan, The Arabian Nights (cerita sebenarnya berasal dari teks Persia Tengah berjudul Hezar Afsaneh atau Seribu cerita dan memuat cerita-cerita dari Persia, India, Arab dan Yunani), dasar dari ceritanya adalah seksual. Dalam cerita berbingkai yang terkenal, pangeran Persia, Shahryar, membunuh istrinya setelah mengetahui perselingkuhannya. Seorang misoginis yang sakit hati, dia memutuskan untuk meniduri perawan baru setiap malam dan membunuhnya keesokan harinya, sehingga tidak sempat untuk mencemarkan nama baiknya. Ilustrasi pangeran Persia Shahryar dan Scheherazade oleh A. Houghton Akhinrya, putri dari perdana menterinya, Shahrzad (atau Scheherazade, seperti yang dikenal oleh pembaca Barat) diberikan sebagai istri Shahryar. Di kamar tidur sang pangeran, bangsawan Persia yang cerdik untuk menceritakan dongeng demi dongeng yang sanat menghibur. Saking terpesonanya, Sharyar mendesak Shahrzad untuk mendongeng kisahnya dari malam ke malam sampai ia menaklukkan hatinya dan menjadi istri Shahryar. Sementara beberapa cerita terkenal yang termasuk dalam koleksi dongeng Seribu Satu Malam telah disadur menjadi film dan kartun anak-anak (misalnya Aladdin, Sinbad the Sailor, Alibaba dan Empat Puluh Pencuri dari Baghdad), cerita aslinya tidak ada yang polos. Meraba-raba dari dongeng Shahrzad yang menggambarkan para pecinta dalam pergolakan gairah, pada masa ""ketika anak laki-laki melupakan ibu mereka"". Pier Paolo Pasolini, bisa dikatakan, adalah salah satu dari sedikit orang yang menyadari dan menghargai erotika yang melekat dalam dongeng-dongeng ini. Sampai saat ini, adegan paling terkenal dari film The Flower of the Thousand and One Nights pada tahun 1974 (sebagian gambit diambil di Iran dan Yaman) adalah ketika seorang pemuda Ninetto Davoli menunjuk, dalam kondisi bugil, sebuah panah berbentuk lingga pada selangkangan kekasihnya. Priapus, makanlah hatimu. ""Jelas bahwa isi yang kuat, sensual bahkan porno dalam cerita Seribu Satu Malam dapat disejajarkan dalam literatur Arab,"" tulis ilmuwan Robert Irwin dalam tajuk komentarnya tentang Seribu Satu Malam pada 2010. Memang, di luar taman dan malam-malam Shahrzad, seseorang dapat menunjuk karya-karya lain yang berhubungan dengan erotika, seperti tulisan ilmuwan Abbasiyah Al-Jahiz tentang tata cara laki-laki dan perempuan muda, Ensyclopaedia of Pleasure yang dibuat Al Katib pada abad ke-10 dan bahkan Sidang Jemaat al-Hariri, sebuah teks dari kekaisaran Seljuk dengan bagian-bagian tentang homoseksualitas. Selain itu, di Persia dan bukan di Arab, seorang polymath Nasiruddin Tusi, menulis teks berbahasa Arab tentang stimulan seksual dan berbagai posisi yang baru-baru ini tersedia bagi para pembaca Inggris sebagai The Sultan's Sex Potions. Cinta Modern Erotika sastra Arab, bagaimanapun, tidak terbatas pada Abad Pertengahan; Jika ada, generasi baru penulis Arab telah mendorong batas-batasnya dan membuatnya tetap menyala. Tulisan karya Leïla Marouane berjudul The Sexual Life of an Islamist in Paris (2010), misalnya, menceritakan tentang kesialan lucu seorang perawan Aljazair dan hubungan seksualnya yang terputus-putus. Demikian pula, karya Ammar Abdulhamid berjudul Menstruation (2001) berkisah tentang anak seorang imam dengan bakat penciuman unik yang terlibat dalam perselingkuhan yang manis dengan wanita yang sudah menikah. Pada tahun 2005, The Almond, yang ditulis dengan nama samaran 'Nedjma' diterbitkan dan yang disebut pada saat itu sebagai 'teks erotis pertama yang ditulis oleh seorang wanita Arab'. Artis Pearl Argyle dan John Garrick ketika berperan dalam film musikal Arabian Nigts, 'Chu Chin Chow' yang disutradari oleh Walter Forde Dan, meski tidak harus jatuh di bawah payung erotika, orang tetap dapat menunjuk pada karya klasik yang penuh dengan momen-momen yang tidak menyenangkan seperti Season of Migration to the NorthkaryaTayeb Salih (1966), trilogi novel Hisham al-Abir dari penulis Turki al-Hamad (dilarang di negara asalnya, Arab Saudi), dan tulisan-tulisan otobiografi Mohamed Choukri dari Maroko, penuh dengan rincian tentang pelacur dan penyakit kelamin. Haruskah penonton non-Arab terkejut dengan keberadaan judul seperti itu, baik sejarah maupun kontemporer? Menurut ilmuwan dan penulis Suriah Salwa Al Neimi, sama sekali tidak. ""Bahasa Arab adalah bahasa seks"", kata protagonisnya yang penuh gairah dalam novelnya The Proof of the Honey (2009). Memang, bertentangan dengan ketidakpercayaan bahwa seks itu tabu dalam Islam dan masyarakat Arab Muslim, Al Neimi - seperti orang-orang sepertinya sebelumnya - menunjukkan bahwa bukan hanya bukan sesuatu yang tabu, tapi justru dirayakan juga. Meskipun norma sosial dan agama dapat mendikte apa yang terjadi di depan umum, di balik pintu tertutup di dunia Arab (dan di halaman buku), anak laki-laki akan menjadi anak laki-laki, dan anak perempuan akan menjadi anak perempuan. Snitz Edwards dan Anna Wong dalam The Thief of Baghdad, film bisu garapan Raoul Walsh yang menyadur cerita Seribu Satu Malam Ini bukan untuk menyiratkan bahwa dunia Arab semacam situs seks cabul rahasia, seperti yang sering digambarkan oleh para penulis dan pelukis Eropa, karena lebih jauh dari bentuk sensual yang sering dirasakan saat ini. Sementara Kama Sutra dapat mengambil porsi kue dari segi popularitas, rasa dari The Perfumed Garden dan buah-buahnya yang sangat enak -bersama dengan Seribu Satu Malam dan kisah erotis klasik dari Arab lainnya- mungkin cukup untuk membuat murid Vãtsyãyana yang paling bersemangat sekalipun berubah menjadi merah seperti buah bit. Jika bahasa Arab menjadi bahasa seks, teruslah membaca.","Jika kita berbicara tentang hawa nafsu, sering ada kecenderungan untuk menghubungkannya dengan roman Shades of Grey , gadis kecil bernama Lolita, atau mungkin Lady Chatterly, dan burung-burung kecil yang terbang ke segala arah."
