article,summary
"Presiden Duterte perintahkan pembagian alat kontrasepsi gratis.
Diperkirakan sekitar enam juta perempuan Filipina menginginkan alat kontrasepsi namun tidak bisa mendapatkannya. Tujuannya adalah untuk mencegah peningkatan jumlah kehamilan yang tidak diinginkan, khususnya di kalangan kelompok miskin. Bagaimanapun langkah ini tampaknya akan ditentang oleh sejumlah penganut Katolik, yang merupakan mayoritas di negara tersebut. Menteri Perencanaan Ekonomi, Ernesto Pernia, mengatakan upaya meningkatkan ketersediaan alat kontrasepsi untuk menjamin ""kebutuhan yang tidak dipenuhi dalam keluarga berenana"" dan amat penting dalam mengurangi kemiskinan. Peningkatkan ketersediaan alat kontrasepsi dianggap penting dalam mengurangi kemiskinan. Pemerintah Filipina menerapkan sasaran penurunan tingkat kemiskinan dari 21,6% pada tahun 2015 menjadi 13% hingga 14% pada masa akhir kepemimpinan Duterte tahun 2022 mendatang. Peningkatan keluarga berencana Diperkirakan enam juta perempuan Filipina menginginkan alat kontrasepsi namun tidak bisa mendapatkannya. Perintah eksekutif Duterte, seperti dilaporkan kantor berita Associated Press, menyebutkan sedikitnya dua juta perempuan akan mendapat akses atas alat kontrasepsi pada 2018 dan sisanya menyusul. Selain itu badan-badan pemerintah juga diperintahkan mengidentifikasi pasangan-pasangan yang belum memenuhi program keluarga berencana dan melakukan mobilisasi pada tingkat kampung untuk meningkatkan keluarga berencana. Pemerintah Filipina menerapkan sasaran penurunan tingkat kemiskinan dari 21,6% tahun 2015 menjadi 13% hingga 14% pada 2022 mendatang. Badan Kependudukan PBB tahun lalu mengatakan Filipina merupakan satu-satunya negara di Asia Pasifik dengan tingkat kehamilan di kalangan remaja yang meningkat dalam dua dekade belakangan. Jumlah penduduk Filipina saat ini mencapai 104 juta dengan tingkat pertumbuhan sekitar 1,7%.","Presiden Filipina, Rodrigo Duterte, memerintahkan pembagian alat kontrasepsi gratis kepada sekitar enam juta perempuan yang tidak bisa mendapatkannya."
"Mesir melaksanakan referendum atas RUU.
Seorang wanita memberikan suara dalam referendum Mesir Presiden Mohammed Morsi dan partai Ikhwanul Muslimin selama ini gencar berkampanye mendukung RUU yang menurut oposisi dirancang dengan ceroboh dan terlalu Islami. Pemungutan suara berlangsung di Kairo, Alexandria dan delapan provinsi lainnya, sepekan sebelum dilakukan secara nasional. Sekitar 250 ribu personil keamanan dikerahkan untuk memastikan situasi kondusif. Lebih dari 51 juta orang terdaftar sebagai pemilih sah. Jajak pendapat harus diperluas sebab hanya sedikit hakim yang bersedia mengawasi referendum ini. Kelompok-kelompok hak asasi manusia mengutarakan ketakutan mereka bahwa hasil dari putaran pertama dapat mengubah opini mereka yang memberikan suara di putaran kedua. Mobil dibakar Referendum itu meminta rakyat Mesir untuk menerima atau menolak dokumen dasar yang sudah harus disahkan sebelum pemilu dilaksanakan awal tahun depan. Wartawan BBC Jon Leyne di Kairo mengatakan oposisi dari RUU ini berargumen bahwa RUU cenderung menerapkan hukum Islam. Ia mengatakan referendum itu lebih dari sekedar jajak pendapat. Even ini adalah masa depan Mesir, apakah akan menjadi negara Islam atau negara sekuler. Kedua belah pihak mengerahkan para pendukung mereka dalam unjuk rasa terakhir hari Jumat. Bentrokan terjadi di kota Alexandria ketika para aktivis berkelahi dengan kayu, batu dan senjata lainnya. Sejumlah mobil di bakar dan 15 orang terluka. Kekerasan pecah setelah seorang ulama di sebuah masjid mendorong jamaah agar mendukung RUU itu. Hari ini keamanan diperkirakan akan sangat rentan di Mesir setelah Presiden Morsi memberikan tentara wewenang untuk menangkap warga sipil.",Rakyat Mesir memberikan suara mereka dalam referendum rancangan undang-undang yang telah memecah belah negara itu.
"Jerman dan Prancis minta pengungsi disebar.
Arus pengungsi dan migran mengalir ke wilayah Eropa barat melewati Yunani dan Hongaria. Presiden Prancis Francois Hollande mengatakan ia dan Kanselir Jerman Angela Merkel telah menyepakati mekanisme untuk menyebarkan para pengungsi dan migran yang kini membanjiri Eropa. Ditambahkan, Prancis bersedia menampung 24.000 orang. ""Kami akan menempuh langkah itu karena saya yakin ini adalah prinsip yang mengikat Prancis,"" kata Presiden Hollande, Senin (07/09). ""Kami akan melakukan hal itu karena ini adalah rencana yang kami ajukan sendiri, dan yang kami harapkan akan diadopsi oleh Eropa keseluruhan,"" katanya. Melalui berbagai rute dan cara, pengungsi berusaha mencapai Jerman. Menurutnya, berdasarkan rencana Komisi Eropa, sebanyak 120.000 pengungsi akan direlokasikan di negara-negara anggota dalam tempo dua tahun mendatang. Sementara itu, Kanselir Jerman Angela Merkel menandaskan negaranya tidak akan mampu mengatasi krisis ini sendiri dan meminta negara-negara lain untuk turut menampung pengungsi. Sejauh ini sekitar 20.000 migran dan pengungsi diperkirakan sudah tiba di Jerman akhir pekan lalu, sebagian besar dari negara-negara yang dilanda perang seperti Suriah dan Afghanistan. Namun usulan Prancis dan Jerman ditentang oleh Perdana Menteri Hungaria Viktor Orban yang menegaskan kuota tidak akan mungkin diterapkan berdasarkan sistem Uni Eropa yang berlaku sekarang.",Pemimpin Jerman dan pemimpin Prancis mengajukan proposal sistem baru untuk mendistribusikan para pengungsi di antara negara-negara anggota Uni Eropa.
"Aung San Suu Kyi akan absen di sidang Majelis Umum PBB.
Aung San Suu Kyi dikritik karena dia diam akan kekerasan di Rakhine. Sekitar 370.000 Muslim Rohingya telah menyeberang ke Bangladesh sejak kekerasan di negara bagian Rakhine meningkat bulan lalu. Suu Kyi menghadapi tuduhan dari para pendukung di Barat bahwa dia memilih diam terhadap aksi kekerasan tersebut. Sejauh ini, militer Myanmar mengatakan bahwa mereka memerangi militan Rohingya dan membantah laporan bahwa mereka menargetkan warga sipil. Seorang juru bicara pemerintah untuk Suu Kyi, Zaw Htay, mengatakan ""dewan negara tidak akan hadir"" di sidang Majelis Umum, meski dia berbicara di forum tersebut pada tahun lalu. Namun dia tidak memberikan rincian lebih lanjut. Para relawan di Bangladesh membagikan makanan kepada pengungsi Rohingya, 10 September 2017. Utusan Myanmar untuk PBB menyalahkan gerilyawan Rohingya atas kekerasan di negara bagian Rakhine dan mengatakan bahwa Myanmar tidak akan pernah mentolerir kekejaman tersebut. Namun banyak dari mereka yang melarikan diri mengatakan tentara yang menyerang balik serangan militan Rohingya pada tanggal 25 Agustus dengan kekerasan dan pembakaran desa yang brutal bertujuan mengusir mereka. Myanmar sebelumnya mengecam usulan Komisaris Tinggi PBB untuk Hak Asasi Manusia, Zeid Raad al-Hussein, bahwa perlakuan Myanmar terhadap Muslim Rohingya terhitung ""pembersihan etnis"". Orang-orang Rohingya, kelompok minoritas yang tidak memiliki status kewargaan yang kebanyakan beragama Muslim di Rakhine yang mayoritas beragama Hindu, telah lama mengalami persekusi di Myanmar, yang mengatakan bahwa mereka adalah imigran ilegal. Dewan Keamanan PBB dijadwalkan bertemu pada hari Rabu untuk membahas krisis tersebut.","Pemimpin de facto Myanmar, Aung San Suu Kyi akan absen di Majelis Umum PBB pada pekan depan, karena semakin banyak kritik yang muncul atas penanganannya terhadap krisis Rohingya."
"Usulan perubahan nama Kazakstan.
Presiden Nursultan Nazarbayev sebelumnya mengganti nama ibukota menjadi Astana. Dalam konferensi persnya, Jumat 7 Februari, Nazarbayev mengatakan bahwa Kazakstan sering dikaitkan dan bahkan dianggap sebagai negara-negara miskin yang beraliran stan di kawasan itu. ""Di nama negara kami ada akhiran stan yang juga dimiliki oleh negara lainnya."" ""Namun, contohnya, warga asing memperlihatkan ketertarikan pada Mongolia, yang jumlah penduduknya hanya dua juta lebih dan namanya tidak berakhir dengan stan,"" tambahnya. Nazarbayev -yang sudah berkuasa selama 20 tahun lebih- mengusulkan nama baru Kazakh Eli yang artinya orang Kazakh. Kazakstan merupakan negara terbesar kesembilan di dunia berdasarkan luas wilayahnya dengan jumlah penduduk sekitar 17 juta. Bersama dengan empat negara di Asia Tengah lain yang masuk dalam Uni Soviet -Kirgistan, Tajikistan, Turkmenistan, dan Usbekistan- negara ini kaya dengan sumber minyak. Tahun 1997, presiden berusia 73 tahun ini memindahkan ibukota dari Almaty di sebelah tenggara Kazakstan ke Akmola di kawasan padang rumput di bagian utara. Setahun kemudian dia mengganti nama Akmola menjadi Astana yang dalam bahasa Turki berarti ibukota. Bagaimanapun dalam usulan perubahan nama negara, dia mengatakan perlu membahasnya dengan rakyat tanpa menjelaskan lebih lanjut bentuk pembahasan itu.","Presiden Kazakstan, Nursultan Nazarbayev, mengusulkan pergantian nama negara dengan mencabut akhiran stan."
"Keluarga korban penembakan tentara AS dapat kompensasi.
Sersan Bales juga didakwa melakukan enam kali percobaan pembunuhan. Mereka menerima uang senilai $46.000 (atau sekitar Rp420 juta) untuk tiap korban yang terbunuh, serta $10.000 (Rp91,5 juta ) untuk tiap korban yang luka, kata sejumlah pejabat dan pemimpin suku Afghanistan yang dihubungi BBC. Sersan AS Robert Bales didakwa pada Jumat (23/3) dengan 17 kasus pembunuhan. Serangan di provinsi Kandahar pada tanggal11 Maret itu telah mengakibatkan makin buruknya hubungan Kabul dan Washington. Belum jelas siapa yang memberi kompensasi uang ini kepada keluarga para korban, yang tinggal di distrik Panjwai. Anggota keluarga para korban hadir dalam sebuah pertemuan dengan sejumlah awak dari militer AS dan perwakilan tentara NATO di kantor gubernur Kandahar. Keluarga-keluarga ini diberitahu bahwa sebagian saksi akan diterbangkan ke AS untuk memberikan kesaksian -sementara keluarga korban lainnya akan ikut didengar kesaksiannya melalui saluran video jarak jauh- saat Sersan Bales disidangkan. 'Tak mengaku' Angkatan Bersenjata AS Jumat lalu mengatakan Sersan Bales telah secara resmi didakwa dengan 17 dakwaan pembunuhan berencana terhadap sembilan anak dan delapan warga dewasa Afghanistan. Menurut sejumlah pejabat resmi negara itu ada 16 korban tewas -12 di wilayah Balandi dan empat di Alkozai- namun militer AS belum menjelaskan kenapa ada ketimbangan jumlah korban dibanding dakwaannya. Sersan Bales, 38, juga didakwa melakukan enam percobaan pembunuhan dengan menyerang seorang pria, wanita dan empat anak-anak. Saat ini tersangka ditahan di penjara militer Fort Leavenworth, Kansas, dimana dia dikurung di sel isolasi setelah dibawa dari Afghanistan pekan lalu. Kuasa hukumnya, yang membantah Bales tengah mabuk saat melakukan pembunuhan itu, mengatakan Bales hanya ingat ""sedikit sekali"" insiden yang terjadi. Sang pengacara, John Henry Browne, mengatakan tak ada ""bukti forensik"" yang membuktikan kesalahannya sementara Bales juga ""tak mengaku"" melakukan kekejaman itu. Bales adalah tersangka tunggal dalam kasus ini meskipun pihak Afghanistan beberapa kali menuding ada lebih dari seorang warga AS yang terlibat dalam kasus tersebut. Sidang pengadilan kasus ini bisa berjalan bertahun-tahun, berlawanan dengan tuntutan warga Afghanistan yang menginginkan keadilan ditegakkan sesegera dan setegas mungkin. Sementara itu, bila dakwaan dikabulkan maka Bales bisa menghadapi hukuman mati.","Keluarga Afghanistan yang jadi korban penembakan membabi-buta yang dilakukan seorang tentara AS di Kandahar diberi kompensasi uang, demikian konfirmasi yang diterima BBC."
"Mata uang Iran capai 'rekor terendah baru'.
Rial terus melemah di pasar mata uang selama beberapa hari terakhir. Beberapa laporan menyebutkan rial penurunan dalam perdagangan Selasa mencapai 10% menyusul penurunan pada Senin sebesar 18%. Mata uang diperdagangkan pada tingkat 35.000 hingga 37.000 per satu dolar Amerika Serikat. Dibanding nilai tahun lalu, nilai rial saat ini turun lebih dari 80%. Menteri Perindustrian, Pertambangan dan Perdagangan Iran Mehdi Ghazanfari menuding para spekulan berada di balik penurunan rial dan berharap pihak berwenang bisa mengawasi praktek mereka. ""Kami sangat berharap aparat keamanan akan mengontrol cabang-cabang dan sumber-sumber gangguan di pasar valuta,"" tegasnya seperti dikutip kantor berita Iran, Fars. ""Para pialang di pasar juga berusaha menaikan harga karena akan menguntungkan mereka, dan tak ada seorang pun yang mengawasi mereka,"" tambah Ghazanfari. Di tengah anjloknya rial, bank sentral Iran memberlakukan pembatasan mata uang asing yang boleh dibawa masuk atau ke luar dari Iran. Setiap orang tidak boleh membawa lebih dari US$5.000. Sanksi ekonomi ""Para pialang di pasar juga berusaha menaikan harga karena akan menguntungkan mereka, dan tak ada seorang pun yang mengawasi mereka."" Mehdi Ghazanfari Dampak penurunan mata uang ini langsung dirasakan penduduk Iran. ""Kami adalah penyewa rumah dan dampak pertama penurunan nilai mata uang ini adalah kenaikan sewa, dan kemudian dampaknya merembet ke sisi-sisi lain, misalnya kami tidak bisa berlibur sesering dulu,"" kata seorang warga di Teheran. Seorang warga lain, Mahmoud, mengatakan dia curiga mengapa pemerintah atau pihak berwenang tidak membicarakan masalah itu tetapi justru berdiam diri. ""Saya asumsikan mereka menginginkan nilai mata uang menyentuh titik terendah agar setelah beberapa waktu mereka bisa memangkas harga setengahnya. Jadi nilainya akan lebih tinggi dari sebelumnya dan pemerintah akan mengisyaratkan kepada rakyat bahwa pemerintah telah mencapai keberhasilan besar,"" tutur Mahmoud. Amerika Serikat mengatakan Iran mengalami dampak buruk akibat sanksi ekonomi terkait program nuklirnya. Iran membantah keras tuduhan Barat bahwa negara itu berusaha mengembangkan senjata nuklir. Wartawan BBC, Amir Paivar, mengatakan sebagai akibat dari sanksi ekonomi, pendapatan Iran dari ekspor minyak turun 45% tahun ini sehingga menyebabkan kelangkaan dolar dan mata uang asing lainnya. Link terkait Topik terkait","Mata uang Iran rial terus menurun terhadap dolar Amerika Serikat dengan penurunan sekitar 10% dalam perdagangan sesi pagi, Selasa, 2 Oktober."
"Taliban kecam penundaan perundingan damai.
Taliban Pakistan mengirim tiga orang delegasi ke perundingan tetapi wakil pemerintah tidak hadir. Dalam perundingan awal, delegasi pemerintah tidak hadir di arena pertemuan padahal tiga wakil Tehreek-e-Taliban Pakistan (TTP) sudah menunggu. Kedua kubu dijadwalkan mulai menyusun perundingan ""peta jalan"". ""Saya mengatakan kepada mereka untuk mempertimbangkan peluang ini sebagai berkah Allah karena kami terlibat, dan Taliban dalam menjembatani masalah ini, dan pemerintah seharusnya menggunakan jembatan ini bagi perundingan lebih lanjut,"" kata ulama Pakistan, Maulana Samiul Haq, yang menjadi salah seorang anggota delegasi Taliban Pakistan. ""Tetapi pemerintah tidak memanfaatkan peluang ini,"" tambahnya. Salah satu utusan delegasi pemerintah, seorang wartawan senior Rahimullah Yusufzai, mengatakan pihaknya ingin menegaskan terlebih dulu siapa saja anggota delegasi Taliban dan wewenang yang mereka pegang. Yousufzai mengatakan begitu pemerintah menerima konfirmasi maka perundingan bisa diadakan nanti. Para wartawan mengatakan ada sikap skeptis tentang prospek perundingan karena Taliban menuntut penerapan hukum syariah dan pembebasan tahanan. Taliban Pakistan adalah koalisi militan Islam radikal yang ingin menerapkan hukum Islam. Hampir 1.200 warga sipil dan aparat keamanan tewas dalam serangan yang dilakukan kelompok itu tahun lalu saja.",Delegasi Taliban Pakistan mengecam ketidakhadiran delegasi pemerintah dalam perundingan yang sedianya diadakan di Islamabad hari Selasa (04/02).
"Virus Zika: 'Teori Piala Dunia' tak terbukti.
Temuan penelitian menyatakan virus Zika sudah ada di Brasil sebelum Piala Dunia 2014 di negara itu dimulai. Penelitian mereka membantah salah satu teori paling populer soal asal-muasal virus tersebut - dibawa oleh penonton bola. Temuan yang diterbitkan di jurnal Science, menyatakan bahwa virus datang antara Mei dan Desember 2013, jauh sebelum kasus pertama terdeteksi pada 2015. Teori populer lain - dibawa saat perlombaan dayung World Sprint Championship pada 2014 - juga sudah dibantah. Kasus awal Menelusuri awal sebuah virus adalah sebuah upaya besar memetakan genealogi genetik. Peneliti menganalisis kode genetik dari tujuh sampel Zika di seluruh Brasil. Pertama, mereka menemukan bahwa semua virus berhubungan dekat, sehingga menunjukkan bahwa infeksi di Brasil berasal hanya dari satu orang. Virus itu kemudian menyebar ke 34 negara atau teritori. Namun Zika adalah virus yang bermutasi dengan cepat. Perbedaan kecil antara satu sampel dengan lainnya memungkinkan peneliti untuk menyusun ulang silsilah keluarga Zika dan memperkirakan masa kedatangan awal virus ini di Brasil. Peneliti pun menyimpulkan bahwa virus tersebut tiba sekitar pertengahan sampai akhir 2013. Peneliti menyatakan masih perlu banyak penelitian lain untuk membenarkan keterkaitan antara virus Zika dan mikrosefali. Profesor Oliver Pybus, dari University of Oxford, mengatakan pada BBC News: ""Kami tak bisa memastikan bagaimana virus tersebut bisa sampai di benua Amerika, tapi kami yakin bahwa virus sudah ada di benua ini sebelum mulainya Piala Dunia 2014."" ""Kami juga melihat jumlah penumpang yang datang ke Brasil dari negara-negara yang mencatat penularan Zika dalam beberapa tahun terakhir dan kami menemukan ada 50% peningkatan penumpang pada rute tersebut. Itu bisa menjadi alasan munculnya Zika."" Virus yang muncul di negara-negara Amerika Selatan terkait erat dengan penyebaran Zika di Polinesia Prancis pada 2013. Meski kemungkinannya ini adalah sumber dari penyebaran virus, namun peneliti kekurangan sampel dari negara-negara lain - terutama Asia Tenggara - sehingga mereka tak bisa memastikan. Salah satu aspek paling mengkhawatirkan dari penyebaran virus Zika adalah kemungkinan adanya kaitan erat dengan peningkatan kasus bayi-bayi yang lahir dengan ukuran kepala yang lebih kecil dari bayi-bayi normal. Dokter Nuno Faria, salah satu peneliti di Evandro Chagas Institute, mengatakan data mereka ""konsisten"" dengan kemungkinan Zika bisa menyebabkan kelainan otak. Namun dia memperingkatkan bahwa masih perlu banyak penelitian untuk membenarkan keterkaitan tersebut.","Virus Zika sudah ada di Amerika Selatan setahun sebelum Piala Dunia 2014 di Brasil, menurut peneliti Inggris dan Brasil."
"Hong Kong: Mengapa demonstran menyerang Starbucks?.
Sejumlah pekerja membersihkan kedai Starbucks yang dirusak pedemo anti-China di Hong Kong, 30 September lalu. Namun di tengah kericuhan, sebagian besar orang yang disebut pro-demokrasi secara sadar menyerang sejumlah tempat. Pertanyaannya, mengapa para demonstran itu mengincar gerai kopi Starbucks? Mengapa kereta bawah tanah? Dan mengapa pula toko, restoran, dan bank tertentu juga menjadi sasaran? Ada target yang pasti... Situasi di Hong Kong saat ini rumit, tapi secara umum terbagi antara mereka yang menentang dan mendukung pemerintah China. Saat unjuk rasa damai beralih wujud serangan terhadap properti, sejumlah korporasi besar asal China seperti Bank of China dan perusahaan teknologi Xiaomi menjadi target vandalisme. Namun ada beberapa lokasi lain yang juga menjadi target. Mengapa Starbucks? Walau gerai kopi ini berasal dari Amerika Serikat, operasionalnya di Hong Kong dijalankan oleh perusahaan lokal, yaitu Maxim's Caterers. Annie Wu, putri pendiri perusahaan itu, baru-baru ini mendukung kepolisian Hong Kong dan mengkritik pengunjuk rasa yang disebutnya sebagai pedemo radikal. Wu menyatakan sikapnya itu bersama pengusaha Pansy Ho. Nama terakhir mewakili Federasi Perempuan Hong Kong dalam forum Komisi HAM PBB 11 September lalu. Wu dan Ho menuduh sekelompok kecil pedemo radikal menggunakan kekerasan yang terukur dan sistematis. Dampaknya, sejak saat itu para pengunjuk rasa mulai mengarahkan kemarahan terhadap Maxim's Caterer dan gerai waralaba di bawah pengelolaannya. Maxim adalah salah satu perusahaan bidang makanan dan minum yang terbesar di Hong Kong. Mereka juga mengendalikan Genki Sushi dan toko roti Arome. Dua gerai merek itu juga menjadi sasaran pedemo. Belakangan Maxim menerbitkan pernyataan tertulis yang mengklaim Wu tidak memegang jabatan apapun dalam perusahaan mereka. Maxim juga menyebut Wu tidak terlibat dalam pengambilan kebijakan apapun. Namun klaim itu sejauh ini belum dapat menenangkan para demonstran. Jaringan makanan cepat saji asal Jepang, Yoshinoya juga menjadi target pedemo. Belum lama ini muncul kegamangan terhadap sebuah unggahan di Facebook yang menyebut operator Yoshinoya di Hong Kong mendukung kepolisian dan pemerintah. Namun ada sebagian orang yang membaca unggahan di Facebook itu sebagai kode sindiran terhadap aparat keamanan setempat. Dan tak lama setelahnya, jendela sejumlah restoran asal Jepang itu pun dipecahkan pedemo. Dinding rumah makan mereka pun kini penuh grafiti. Apakah Triad terlibat? Target pedemo lainnya adalah Best Mart 360, sebuah jaringan swalayan. Ini merupakan contoh bagaimana populasi Hong Kong kini terbelah. Pimpinan Best Mart 360 adalah Hugo Lam Chi-fung. Ia berstatus presiden kehormatan di Federasi Hong Kong untuk Asosiasi Fujian. Lembaga itu beberapa kali turun ke jalan menyatakan dukungan untuk China. Fujian adalah sebuah provinsi di China. Selama bertahun-tahun banyak warga Fujian yang bermigrasi ke Hong Kong. Komunitas pendatang asal Fujian sejauh ini terlihat vokal menyokong kepolisian. Unjuk rasa lembaga ini beberapa kali berakhir bentrokan dengan pedemo yang menuduh kartel bandit asal Fujian turut terlibat. Best Mart 360 sejauh ini juga sudah mengeluarkan pernyataan resmi bahwa mereka tidak terlibat dengan kelompok triad manapun. Dugaan keterlibatan triad juga diarahkan pedemo pada pusat permainan mahyong di pemukiman komunitas Fujian. Yi Pei Square dituding menjadi tempat persembunyian kelompok pro-Beijing yang menyerang warga Hong Kong. Rumah permainan mahyong itu menyatakan tak berkaitan dengan orang-orang asal Fujian. Mereka juga mengklaim mendukung tuntutan kelompok anti-Beijing. Kesalahpahaman dan permintaan maaf Ada pula kejadian di mana sejumlah tempat menjadi sasaran kemarahan pedemo yang salah paham. Shanghai Commercial Bank tidak dimiliki orang-orang dari China walau namanya mencerminkan suatu wilayah di negara komunis itu. Jejaring minuman teh Yifang juga keliru dikaitkan dengan China meski faktanya berasal dari Taiwan. Para demonstran keliru menargetkan gerai dua merek itu. Belakangan mereka meminta maaf dan membersihkan gerai yang mereka serang. Untuk mencegah kesalahpahaman dan mengkoordinasikan aksi, para demonstran kini menggunakan sistem pengenal warna. Hitam, merah, dan biru digunakan sebagai pembeda untuk menghancurkan suatu tempat, mencoret-coret atau sekedar memboikot keberadaannya. Sementara itu, warna kuning digunakan untuk menandai perusahaan yang menyokong gerakan anti-China. Mengapa transportasi publik juga diserang? Stasiun kereta bawah tanah Hong Kong juga berulang kali menjadi sasaran vandalisme, bahkan dibakar selama unjuk rasa. Perusahaan kereta bawah tanah MTR berstatus korporasi terbuka. Pemerintah Hong Kong merupakan pemegang saham terbesar mereka. Demonstran kerap merusak stasiun kereta bawah tanah. Pertengahan Agustus silam, MTR dikritik media massa milik pemerintah China. Mereka dituduh membantu mobilisasi pengunjuk rasa. Setelahnya, MTR menutup sejumlah stasiun sebelum kelompok demonstran berkumpul. Suatu kali, seluruh sistem kereta bawah tanah juga dihentikan. Kelompok anti-Beijing kini menuduh MTR membantu polisi menangkap pengunjuk rasa. Mereka juga dikritik karena enggan merilis rekaman kamera pengawas yang memperlihatkan dugaan kebrutalan polisi. Tambahan reportase dikerjakan wartawan BBC Chinese, Lam Cho Wai","Kaca-kaca pecah, amukan api, dan kumpulan orang yang dipukuli. Beragam potret dari Hong Kong memperlihatkan wilayah itu tengah dirundung kekacauan."
