article,summary
"Aktor laga Holywood Steven Seagal jadi duta khusus pemerintah Rusia.
Steven Seagal memuji Presiden Putin dan membela Rusia tyerkait tuduhan keterlibatan dalam Pilpres AS 2016. Pada tahun 2016 lalu bintang laga itu diberi kewarganegaraan Rusia. Ia juga memuji Presiden Putin sebagai pemimpin dunia yang hebat. Kementerian luar negeri Rusia mengumumkan keputusan itu di halaman Facebook resmi mereka. Disebutkan, jabatan yang tidak mendapat gaji itu mirip dengan duta besar kehormatan PBB. Dan Seagal akan mempromosikan peningkatan hubungan AS-Rusia ""dalam lingkup kemanusiaan"". Bintang laga Amerika itu salah satu bintang Hollywood yang dituduh sebagai pelaku sejumlah serangan seksual. Tuduhan yang dilontarkan sejumlah perempuan dalam kampanye #MeToo itu telah dibantahnya. Seagal adalah seorang praktisi karate yang mendapatkan ketenaran internasional untuk peran-perannya di sejumlah film tahun 1980 dan 1990-an seperti Under Siege dan The Flight of Fury, namun masih populer di kalangan penonton Rusia. Belum lama ini, Seagal membela pemerintah Rusia terkait tudingan keterlibatan negeri itu dalam pemilihan presiden AS tahun 2016 yang dimenangkan Donald Trump. Pria berusia 66 tahun itu menyebut Presiden Putin ""salah satu pemimpin besar dunia yang masih hidup."" Dan ketika Seagal diberi kewarganegaraan Rusia, ia mengatakan dia berharap hal itu menandai mulai membaiknya hubungan antara Moskow dan Washington. Pada 2016, Seagal juga diberikan kewarganegaraan Serbia, setelah melakukan kunjungan beberapa kali ke negara Balkan itu.",Pemerintah Rusia telah menunjuk aktor AS Steven Seagal sebagai utusan khusus mereka untuk meningkatkan hubungan dengan Amerika Serikat.
"Twitter menutup layanan video Vine.
Twitter mengakuisisi Vine pada 2012 Vine adalah jasa berbagi video berdurasi enam detik, yang dimainkan berulang-ulang. Alasan penutupan ini tak dibeberkan Twitter, tapi pada Kamis (27/10) mereka mengumumkan akan memangkas sembilan persen dari total karyawan sebagai bagian restrukturisasi perusahaan, ""Dalam beberapa bulan ke depan, kami akan menghentikan aplikasi ponsel Vine,"" kata Twitter dalam tulisan di blog. Ketika mengetahui langkah tersebut, Rus Yusupov - salah satu pendiri Vine - mencuit: ""Jangan jual perusahaanmu!"" Tanda perubahan Twitter mengakuisisi Vine sebelum layanan itu diluncurkan secara resmi pada 2012 seharga $30 juta (sekitar Rp390 miliar), demikian dilaporkan sejumlah media. Namun sejak saat itu, mereka telah mengintegrasikan fasilitas video terpisah ke platform utama Twitter, serta mengakuisisi aplikasi live-streaming Periscope. ""Tak ada yang terjadi dalam aplikasi, situs web, atau Vine hari ini,"" kata tulisan di blog itu. ""Anda tetap dapat mengakses dan mengunduh Vine Anda. Kami akan mempertahankan situs webnya agar kalian dapat menyaksikan semua Vine luar biasa yang telah dibuat."" Banyak, tapi tidak semua, pengguna Twitter terkejut akan pengumuman ini. Matt Pearce (@mattdpearce), misalnya, mencuit ""Benar-benar mencengangkan bahwa Vine akan ditutup, salah satu platform paling kreatif di internet."" Mereka menambahkan bahwa pengguna akan diberi tahu sebelum melakukan perubahan apapun pada aplikasi atau situs web Vine. ""Twitter berusaha membatasi komunikasi - 140 karakter - dan dengan Vine mereka mencoba melakukan hal yang sama dengan video,"" kata Ian Fogg, seorang analis di perusahaan konsultan teknologi IHS Markit. ""Masalahnya adalah Vine tidak mengikuti perkembangan inovasi dari Snapchat, Facebook, dan pemain lainnya di pasaran."" Cuitan terbaru Vine: ""Biarkan cahaya tetap menyala"" kini terasa ironis.","Twitter mengumumkan penutupan layanan berbagi videonya, Vine, empat tahun setelah diluncurkan."
"Nobel kedokteran untuk penyakit parasit.
Sel darah merah yang terinfeksi parasit malaria Plasmodium sp. William C Campbell dan Satoshi Omura mengembangkan obat baru untuk mengatasi infeksi yang disebabkan parasit cacing gelang. Kedua berbagi Nobel dengan Youyou Tu, yang dianggap berjasa dengan temuannya terkait terapi mengatasi malaria, lapor wartawan BBC Michelle Roberts. Dewan Nobel menyatakan upaya ketiganya telah mengubah kehidupan ratusan juta orang yang terkena penyakit-penyakit ini. Penyakit malaria yang disebarkan nyamuk telah membunuh lebih 450.000 orang setiap tahun di dunia dan miliaran lainnya berisiko terkena infeksinya. Cacing parasit mempengaruhi sepertiga penduduk dunia dan menyebabkan sejumlah penyakit, termasuk jenis kebutaan River Blindness dan Lymphatic Filariasis atau atau cacing dalam sistem limpa. Setelah selama puluhan tahun dengan kemajuan yang terbatas, penuemuan dua obat baru -Avermectin untuk River Blindness dan Lymphatic Filariasis, serta Artemisinin untuk malaria- dipandang telah menyebabkan perubahaan besar.",Penghargaan Nobel untuk fisiologi atau kedokteran diberikan kepada dua terobosan dalam pekerjaan terkait penyakit yang diakibatkan parasit.
"Serangan Taliban tewaskan 15 polisi Afghanistan.
Pada hari yang sama serangan juga terjadi atas pangkalan pasukan AS dan Polandia di dekat Ghazni. Ruas melingkar sepanjang 2.200 km itu menghubungkan beberapa kota utama Afghanistan, seperti Kabul, Kandahar, Herat, serta Mazar-i-Sharif dan sering menjadi sasaran serangan kelompok pemberontak. Juru bicara gubernur Provinsi Farah, tempat serangan berlangsung, menjelaskan serangan pada Rabu (28/08) malam waktu setempat terjadi ketika konvoi sedang melakukan inspeksi atas patroli di jalan bebas hambatan. ""Terjadi pertempuran yang menewaskan 15 polisi dan 10 terluka sementara beberapa anggota Taliban juga tewas,"" tutur Abdul Rahman Zhuwandi, seperti dikutip kantor berita AFP. Taliban sudah mengaku bertanggung jawab atas serangan tersebut. Serangan di Ghazni Sebelumnya, masih pada hari yang sama, Taliban menyerang sebuah pangkalan yang menjadi markas tentara Amerika Serikat dan Polandia di Afghanistan Timur. Pasukan internasional sudah menyerahkan kendali keamanan kepada Afghanistan. Kelompok perlawanan berhasil dipukul mundur dari pangkalan yang berada di dekat kota Ghazni tersebut. Seorang tentara Amerika Serikat dilaporkan tewas dalam serangan itu dan 10 tentara Polandia terluka, namun rinciannya masih belum jelas. Dalam beberapa bulan belakangan, Taliban tampaknya meningkatkan serangannya, khususnya setelah pasukan internasional menyerahkan kendali keamanan kepada pasukan Afghanistan dua bulan lalu. Akhir Juni, istana kepresidenan dan sejumlah kantor pemerintah lainnya di ibukota Kabul diserang oleh kelompok militan. Walau tidak ada pejabat tinggi yang menjadi korban, namun serangan tersebut menjadi salah satu petunjuk peningkatan aksi Taliban, yang menolak berunding dengan pemerintahan pimpinan Presiden Hamid Karzai. Saat ini masih terdapat 100.000 pasukan internasional dari 48 negara dan akhir tahun ini jumlahnya akan dikurangi sampai setengah. Semua pasukan tempur rencananya akan meninggalkan negara itu pada akhir tahun depan.",Kelompok Taliban menyerang satu konvoi polisi di jalan bebas hambatan Afghanistan dan menewaskan 15 polisi.
"Gempa guncang propinsi Manipur, India.
Gempa mengguncang Imphal, Propinsi Manipur, India. Gempa terjadi pada pukul 04.35 waktu setempat, sekitar 33km barat laut Imphal, ibukota Propinsi Manipur. Jurnalis BBC Salman Saeed di ibukota Bangladesh, Dhaka mengatakan orang-orang lari berhamburan ke luar rumah. “Tanah bergetar selama hampir satu menit, membuat orang terbangun dan kabur ke luar rumah,” ungkap Apem Arthur, salah seorang warga di Imphal kepada Associated Press. USGS menyebut, setidaknya 98 juta orang di kawasan tersebut merasakan gempa itu. Sejarah panjang Bagian utara Asia Selatan, memiliki sejarah panjang terkait gempa dengan berkekuatan besar, akibat ‘tabrakan’ antara lempeng India dan Eurasia. Kedua lempengan, menurut USGS, bergerak saling berlawanan sejauh empat hingga lima sentimeter setiap tahunnya. Ribuan orang tewas akibat gempa di Nepal, pada April 2015. Pada 2005, gempa berkekuatan 7,6 skala richter mengguncang wilayah Kashmir Pakistan dan menyebabkan lebih dari 75.000 orang tewas. Pada April 2015, Nepal diguncang gempa terburuk yang pernah dirasakan negara tersebut, yang menghancurkan setidaknya 900.000 rumah dan menewaskan 9.000 orang.","Gempa bumi berkekuatan 6,8 skala richter mengguncang timur laut India, dekat perbatasan dengan Myanmar dan Bangladesh, ungkap Badan Survei Geologi Amerika (USGS)."
"Panda Yang Yang melahirkan di Vienna.
Kebanyakan panda berkembang biak melalui inseminasi buatan. Penghuni kebun binatang Schoenbrunn, Yang Yang, terlihat menggendong anak barunya yang berkulit merah muda yang lahir pada Rabu (14/08). Yang Yang hamil secara alami dengan pasangan Long Hui. Kebanyakan panda di penangkaran dibiakkan melalui inseminasi buatan. Bayi dengan ukuran 10 cm, berbobot 100 gram, dan tertutup bulu putih ini, akan tetap dalam isolasi dengan ibunya selama beberapa bulan sampai keduanya memutuskan untuk meninggalkan tempat mereka. Staf kebun binatang tetap optimistis tentang kelahiran ini, walau mengingatkan ada tingkat kematian yang tinggi untuk spesies yang terancam punah ini. ""Meskipun kami tentu saja sangat senang, kita harus tetap realistis. Tingkat kematian bagi panda besar adalah sekitar 40% selama tahun pertama,"" kata direktur kebun binatang Schoenbrunn, Dagmar Schratter. Hanya sekitar 1.600 panda besar diperkirakan tetap berada di alam liar, dengan sekitar 300 ekor berada di penangkaran. Panda betina hanya dapat hamil selama dua atau tiga hari di musim semi, yang membuat reproduksi sangat sulit.","Bayi panda telah lahir di ibukota Austria, Vienna. Sebuah peristiwa yang menggembirakan mengingat hanya ada tiga kelahiran alami panda yang pernah terjadi di Eropa."
"Covid-19: Pandemi virus corona menyebabkan krisis pembalut perempuan di India.
Para pegiat mengatakan produk yang dapat dipakai kembali, seperti pembalut dari kain perca, adalah alternatif yang baik. Selama beberapa tahun, Priya menerima 10 paket pembalut setiap bulan dari sekolahnya. Anak berumur 14 tahun ini tinggal di Badli, daerah kumuh di barat laut Delhi bersekolah di sekolah negeri yang membagikan pembalut kepada seluruh murid perempuan di bawah skema kesehatan reproduksi pemerintah. Ini merupakan kampanye penting di negeri di mana hanya 36% dari 355 juta perempuan menstruasi menggunakan pembalut. Sisanya menggunakan kain bekas, sekam atau abu untuk menghentikan pendarahan. Ditambah lagi fakta bahwa 23 juta perempuan putus sekolah sesudah usia menstruasi mereka. Karena sekolah tutup, terhenti pula pasokan pembalut. “Paket terakhir saya bulan Februari,” kata Priya. “Sesudah itu saya harus beli di apotek terdekat. Harganya 30 rupee untuk satu paket, berisi tujuh pembalut”. Priya termasuk beruntung orang tuanya mampu membelikan pembalut. Banyak tetangganya kehilangan pekerjaan bahkan tak mampu membeli makanan. Perempuan di keluarga-keluarga itu mulai mengganti pembalut dengan kain. Di Bhalaswa Dairy sebuah daerah kumuh tempat tinggal sekitar 1.900 keluarga, seorang pegiat bernama Madhu Bala Rawat, juga menyatakan kekurangan pembalut untuk perempuan usia sekolah. ""Menstruasi tidak berhenti di masa pandemi. Pembalut sangat penting buat perempuan, sama seperti makanan. Kenapa pemerintah mengabaikan permintaan kami,"" tanyanya. Di beberapa kota, polisi membagikan pembalut saat karantina wilayah atau lockdown. Kebayakan perempuan di daerah itu, termasuk anaknya yang berumur 14 tahun, tergantung pada pasokan dari sekolah karena mereka tak mampu membeli pembalut, katanya. “Anak-anak ini khawatir. Mereka tak mau memakai kain lagi karena sudah terbiasa dengan pembalut sekali pakai. Pemerintah harus memasok bersama dengan jatah makanan bulanan”. Sesudah Madhu mengirim pesan, lembaga amal Womenite menyalurkan 150 paket pembalut ke Badli dan Bhalaswa Dairy bulan April. Harshit Gupta, pendiri Womenite, mengatakan mereka telah mengumpulkan dana untuk menyalurkan 100.000 paket pembalut di Delhi dan daerah sekitarnya pada tanggal 28 Mei, seiring peringatan Hari Menstruasi Internasional. Banyak inisiatif serupa di India. Satu perusahaan pembuat pembalut menyalurkan 80.000 paket di Delhi dan Punjab. Polisi di beberapa kota seperti Bangalore, Hyderabad, Jaipur, Chandigarh, Bhubaneshwar dan Kolkata diperbantukan untuk menyalurkan kepada penduduk di daerah kumuh dan mmigran yang terjebak di kamp pengungsian. Menstruasi adalah topik yang tabu dan jarang dibicarakan di keluarga. Minggu ini partai yang berkuasa di India Partai Bharatiya Janata (BJP) mengumumkan akan memberi 600.000 paket kepada polisi untuk disalurkan kepada perempuan remaja di kawasan kumuh Delhi. Tak hanya di desa, kekurangan pembalut juga menimpa, bahkan lebih buruk di pedesaan dan kawasan semi-urban, kata Shailja Mehta, dari Dasra, organisasi amal untuk urusan remaja. “Hasil pembicaraan dengan mitra kami di beberapa negara bagian, kami dengar hanya 15% perempuan punya akses ke pembalut selama karantina.” Masalah berawal ketika India menerapkan karantina tanggal 25 Maret, dan pembalut tidak dimasukkan ke dalam barang esensial yang tak dibatasi peredarannya. Akibatnya, tanggal 29 Maret apotek, toko dan situs belanja daring kehabisan. Barulah pemerintah memasukkan sebagai barang esensial. Keterlambatan ini menyebabkan kehilangan waktu produksi selama 10 hari. “Ketika pemerintah memperbolehkan kami beroperasi, butuh tiga sampai empat hari untuk membuka pabrik lagi karena perlu ada izin bagi pekerja kami,” kata Rajesh Shah, Presiden Asosiasi Feminine and Infant Hygiene India, kepada BBC. Shah mengatakan produksi baru beroperasi sebagian karena ada kekurangan pekerja yang telah meninggalkan kota menuju kampung halaman mereka. “Hanya 60% pabrik yang beroperasi, dan tak ada yang beroperasi dengan kapasitas penuh. Banyak terjadi kekurangan pekerja, atau pabrik yang terletak di kawasan tertutup sehingga tidak boleh buka. Juga ada gangguan terhadap pasokan dan distribusi”. Terjadi kekurangan pasokan pembalut di India. Dampaknya sudah terasa di berbagai daerah di India. Tanya Mahajan dari Menstrual Health Alliance of India (MHAI), adanya “gangguan yang signifikan” terhadap pasokan, terutama di daerah pedesaan terpencil. “Yang pertama menderita, pasti yang terjauh jaraknya,” katanya. “Di desa terpencil pembalut tak tersedia di toko setempat. Orang harus pergi ke kota terdekat yang jaraknya bisa 10-40 kilometer. Karena sekarang sedang ada pembatasan pergerakan, angkutan umum juga tidak ada”. Ditambah lagi, kebanyakan anak perempuan tak nyaman untuk meminta tolong kepada para pria di dalam keluarga untuk membelikan mereka pembalut karena menstruasi merupakan hal tabu yang tak dibicarakan di dalam keluarga India. Sebagai hasilnya, kata Mahajan, banyak perempuan remaja yang tadinya tergantung pada pasokan dari sekolah, mulai mengganti dengan kain. Terlepas dari apa yang dipakai, Arundati Muralidharan dari WaterAid mengatakan penting untuk memastikan kebersihan. Kain yang dipakai berulang harus berbahan katun, dan dicuci dengan bersih lalu dikeringkan di bawah sinar matahari sebelum dipakai lagi. Kedengarannya sederhana, tapi tak mudah untuk dijalankan. Di daerah kumuh ketika para pria di dalam rumah karena karantina, para perempuan akan kesulitan menggunakan fasilitas toilet sesering yang mereka inginkan. Di pedesaan, mendapatkan air tambahan untuk mencuci pembalut kait dan menjemurnya juga tidak mudah.","Perempuan usia pelajar di India mengalami kekurangan pembalut karena sekolah – yang selama ini menjadi tempat distribusi – tutup selama pandemi. Ini membuat jutaan remaja di seluruh India cemas, tulis wartawan BBC Geeta Pandey dari Delhi."
"Oposisi Rusia gelar unjuk rasa besar.
Demonstrasi terjadi sehari setelah polisi menggeledah rumah-rumah sejumlah aktivis. Para penyelenggara mengatakan demonstrasi hari Selasa (12/06) diadakan untuk menuntut pemilihan umum dan presiden baru. Peserta ujuk rasa meneriakkan yel-yel, antara lain ""Rusia akan bebas"" dan ""Rusia tanpa Putin"". Mereka mengaku tidak takut meski polisi kemarin menggeledah rumah-rumah sejumlah aktivis oposisi. ""Mereka yang berjuang tidak mengenal takut,"" kata Valery Zagovny seperti dikutip kantor berita Reuters. Valery Zagovny, 50, adalah seorang warga yang pernah bertugas di Afghanistan untuk militer Rusia. Ketika demonstrasi berlangsung, beberapa situs berita independen tidak bisa diakses. BBC tidak bisa mengakses situs radio Moscow Echo, dan beberapa kantor berita melaporkan kesulitan mengakses situs surat kabar Novaya Gazeta. Penggeledahan Saluran televisi Dozhd mengatakan situsnya mengalami serangan maya dari sumber yang tidak diketahui. ""Kami berusaha memulihkan situs. Serangan dimulai pukul 11:00 waktu setempat,"" kata pemimpin redaksi Mikhail Zygar. Unjuk rasa kali ini tidak diikuti oleh sejumlah penggerak utama oposisi karena mereka sedang menjalani pemeriksaan terkait protes bulan lalu. Kemarin pihak berwenang Rusia menggeledah kediaman para aktivis yang dicurigai terlibat dalam demonstrasi bulan Mei. Di antara rumah yang digeledah adalah kediaman pengacara dan blogger masalah korupsi, Alexei Navalny, dan apartemen pembawa acara televisi Ksenia Sobchak. ""Mereka mengambil uang saya, mereka mengambil telepon genggam saya jadi saya tidak mempunyai telepon genggam lagi. Mereka mengambil komputer, mereka mengambil semua peralatan elektronik, mungkin mereka mengira saya berkomunikasi dengan Departemen Luar Negeri,"" kata Ksenia Sobchak kepada BBC. Amerika Serikat mengatakan penggerebekan itu merupakan upaya untuk membungkam kebebasan berbicara dan berkumpul.","Massa berkumpul di Moskow pusat, Rusia, untuk mengikuti unjuk rasa besar pertama oleh oposisi sejak Vladimir Putin dilantik sebagai presiden pada Mei."
"Sebuah lubang tiba-tiba 'menelan' pejalan kaki di London.
Kini lubang sedalam satu meter itu sudah dipasangi penghalang agar tak terjadi peristiwa serupa. Peristiwa itu terjadi di dekat sebuah kafe di North End Road di Fulham, London barat daya. Regu penolong harus didatangkan untuk menolong perempuan tersebut. Para pejalan kaki berkata, mereka mendengar teriakan keras dan melihat seorang perempuan yang sedang berjalan membawa kereta dorong terperosok ke dalam lubang sedalam sekitar satu meter. Sebelumnya, seorang laki-laki juga terjatuh ke lubang itu dan mengalami keseleo kaki. Pegawai kafe, Mohammed Atillah, sempat menghalangi lubang itu dengan meja dan kursi ketika lubang itu tak seberapa besar. Namun perempuan yang diperkirakan berusia 40 tahun itu menerobos penghalang, lalu kemudian terperosok ke dalam lubang. Kini petugas dewan kota telah meletakkan penghalang di daerah itu untuk mencegah terulangnya peristiwa serupa. Layanan ambulan kota London menyatakan perempuan itu amat terkejut, tapi tak mengalami luka serius.","Seorang perempuan harus mendapat pertolongan sesudah ia ""menghilang"" ditelan sebuah lubang yang tiba-tiba muncul di trotoar."
"Pengusaha muda sembunyikan keberhasilan bisnisnya yang bernilai miliaran 'karena 'malu'.
Adnan mengatakan ia merasa ""sedikit malu"" tentang bisnis onlinenya. Itu tadi pernyataan Adnan Ebrahim, 30 tahun, seorang pengusaha teknologi di Inggris. Ia mendirikan situs Car Throttle, komunitas internet untuk penggemar mobil, dari kamarnya. Adnan sudah menunjukkan jiwa wirausaha sejak kecil. Dalam percakapannya untuk program A Million by 30 (raih £1 juta atau Rp19 miliar) pada usia 30 tahun) dengan Sean Farrington di BBC Radio 5 Live, ia mengatakan untuk pertama kalinya ia melihat potensi mencari uang lewat internet adalah ""saat ia mulai menjual gelang-gelang plastik ke teman-teman sekolahnya pada 2005-2006."" ""Alami kerugian"" Adnan mengatakan penjualan di ""eBay puluhan kali lebih banyak dibandingkan jualan langsung. Saya mulai buat lelang pertama gelang-gelang ini dari rumah."" ""Saya sempat minta ibu saya untuk ke toko dan membeli sebanyak mungkin"". Penghasilannya ia katakan cukup banyak ""untuk ukuran anak sekolah."" Adnan mulai menulis blog tentang mobil setelah rugi dalam jualan iPod melalui online. Pada usia 16, Adnan mulai membuat blog setelah gagal dalam jualan iPod. ""Saya rugi cukup banyak, sampai £2.000...ternyata ada penjual yang palsu,"" katanya. Menulis blog ternyata lebih banyak menghasilkan. Ia penggemar mobil dan mulai menulis berbagai hal tentang mobil. ""Setiap pulang sekolah, saya tulis artikel, diterbitkan. Besoknya saya lihat hasilnya dan cek berapa banyak orang yang baca...dan melihat berapa banyak hasil dari orang mengklik artikel saya."" ""Hidup kedua...'agak malu"" Adnan mulai mencium potensi keuntungan penjualan online setelah uang recehan modalnya menjadi ""sepuluh, dua puluh, lima puluh, seratus...sampai beberapa ribu dolar sebulan."" Adnan mengatakan ""banyak tantangan"" menuju keberhasilan. ""Aneh rasanya, tapi saya suka tak ada orang yang tahu. Jualan online seperti hidup kedua bagi saya."" Sampai tahap ini, belum ada teman-temannya yang ia beritahu. ""Tak ada yang tahu, selain keluarga saya."" ""Saya agak malu, saya ada semacam hidup kedua ini. Saya mulai menulis blog dan saya agak khawatir apa yang akan dipikirkan orang."" ""Saya tidak beritahu teman satu kos sampai tahun kedua tinggal bersama mereka...mereka tak tahu apa yang saya lakukan."" Adnan kini adalah CEO perusahaan kesehatan mental. Wartawan, Treveor Clawson, yang banyak menulis tentang pengusaha teknologi dan perusahaan yang berkembang cepat, mengatakan rahasia yang dipegang Adnan sering dilakukan di antara para pengusaha muda. ""Ada sejumlah alasan di balik ini, untuk tetap merendah pada tahun-tahun awal,"" kata Clawson. ""Takut dikritik bisa menjadi faktor. Kritikan teman untuk satu gagasan yang masih dikembangkan, juga bisa membuat pengusaha membicarakan ide-ide mereka dengan teman-teman mereka."" Adnan sendiri mengatakan ia perlu waktu sebelum bercerita tentang bisnisnya. ""Saya merasa kalau saya cerita, teman-teman tak begitu mengerti dan tertarik juga."" Ia mengatakan ia ingat momen saat mulai bercerita tentang bisnisnya, Car Throttle kepada teman satu kos, namun ternyata tanggapannya, berbeda dari yang ia perkirakan. ""Saya bilang, saya punya sesuatu yang besar. Saya punya situs, dan saya ingat teman saya bilang, 'jadi gimana?', bukan satu hal yang menarik untuk dia,"" cerita Adnan. Angka ""juta""datang cepat Adnan mengatakan dia ingat keuntungan dalam jumlah ""juta"" (dalam poundsterling atau miliaran dalam rupiah), mulai muncul di catatan keuangannya. ""Angka juta datang cepat, pada 2013, 2014, dalam bentuk valuasi bisnis, dan mendapatkan angka satu juta pertama dalam pendapatan, satu juta pertama orang yang langganan YouTube, dan angka satu juta pertama pengikut kami di Facebook...kami berkembang cepat,"" katanya. Ia menjual Car Throttle pada 2019 ke Dennis Publishing, setelah berhasil membangun pengikut lebih dari 15 juta dan 2,5 miliar orang yang menonton video. Douglas McCabe, pakar teknologi dan media serta pemimpin eksekutif Enders Analysis, mengatakan bisnis Adnan, bukanlah situs penting tentang mobil namun berhasil mendapat penonton yang besar. ""Situs ini menarik pembaca baru, dengan lebih dari 60% pelanggan berusia di bawah 35 tahun. Jangkauan dalam media sosial sangat bernilai, sektiar 14 kali dan 17 kali lebih banyak dari situs Auto Express dan Car Buyer."" Tahun ini, Adnan masuk dalam daftar pengusaha sukses di majalah Forbes untuk kategori Forbes' 30 Under 30 (di bawah usia 30 tahun.) Prof Ben Laker mengatakan pengusaha muda sering minder dengan usahanya. Adnan mengatakan ia tidak pernah menyesal memulai bisnis pada saat begitu muda, namun menyatakan ""ia seharusnya lebih agresif meraih peluang."" ""Waktu lebih muda, saya merasa sering minder,"" tambahnya. Ben Laker, profesor di Henley Business School, mengatakan para pengusaha muda sering takut atas keberhasilan mereka sendiri. Adnan saat ini adalah pemimpin eksekutif perusahaan kesehatan mental, MindLabs, yang didirikan bersama mitra kerjanya Gabor Szedlak. Nasihatnya untuk para pengusaha teknologi adalah, ""Jalan menuju keberhasilan tak mudah, banyak tantangan. Yang harus disadari adalah, kita akan melakukan kesalahan, dan itu wajar."" ""Yang perlu dilakukan adalah terus berusaha. Banyak hal yang sulit, itulah yang bisa saya gambarkan apa yang saya lalui,"" tutupnya.","""Saya kagum dengan internet dari dulu. Saya habiskan masa remaja saya di online, membangun jaringan dan bisnis, dan dibesarkan di daerah luar kota, Surrey."""
